Japan’s Hayabusa2 returns asteroid sample to Earth in “perfect condition”;https://www.pbs.org/wgbh/nova/article/hayabusa2-returns-asteroid-ryugu-sample/?amp=1;null;BUSINESS;1607968926.074852;The sample, which is the second-ever to be successfully taken from a space rock and ferried back to Earth, could teach us about the origins of life.
Tongass National Forest is 'America's Last Climate Sanctuary';https://www.pbs.org/wgbh/nova/article/tongass-national-forest-americas-last-climate-sanctuary/?amp=1;https://www.pbs.org/wgbh/nova/media/original_images/DJI_0016.jpg;BUSINESS;1607968926.074852;Opening up the Tongass National Forest to additional logging and development could have serious implications for both the environment and the Alaska Native communities that depend on it.
3D models help preserve landmarks like Notre Dame;https://www.pbs.org/wgbh/nova/article/3d-model-point-cloud-notre-dame/?amp=1;null;BUSINESS;1607968926.074852;Laser-scanning technology can create exceptionally detailed 3D models of cultural sites, bringing them to life online—and helping experts restore them if disaster strikes.
A third Covid-19 vaccine is effective and cheap. What happens next?;https://www.pbs.org/wgbh/nova/article/third-covid-vaccine-astrazeneca-oxford-effective-cheap/?amp=1;null;BUSINESS;1607968926.074852;The Pfizer, Moderna, and AstraZeneca vaccines are at least 90% effective, according to clinical trials. Here’s who may get vaccinated first.
Bring the Science of Taste into the Classroom with NOVA Resources;https://www.pbs.org/wgbh/nova/article/bring-science-taste-classroom-nova-resources/?amp=1;null;BUSINESS;1607968926.074852;Use these NOVA resources to introduce students to neuroscience, chemistry, and biology concepts that explain the science behind flavor, and how smell, sight, and sound can influence the experience.
Pfizer and Moderna Covid vaccines 95% effective in clinical trials;https://www.pbs.org/wgbh/nova/article/pfizer-moderna-covid-vaccines-clinical-trials/?amp=1;https://www.pbs.org/wgbh/nova/media/original_images/Vaccine_Hero.jpg;BUSINESS;1607968926.074852;Both vaccines performed excellently in clinical trials. What comes next?
Toxic synthetic 'forever chemicals' are in our water and on our plates;https://www.pbs.org/wgbh/nova/article/pfas-synthetic-chemicals-water-toxic/?amp=1;null;BUSINESS;1607968926.074852;What makes PFAS chemicals extremely useful—and extremely hard to get rid of—are the bonds between carbon and fluorine atoms that are almost impossible to break.
"The 21st Century Threat to Wildlife is ""Cyberpoaching""";https://www.pbs.org/wgbh/nova/article/21st-century-threat-wildlife-cyberpoaching/?amp=1;https://www.pbs.org/wgbh/nova/media/original_images/Where_confiscated_wildlife_ends_up_-_Moehring_Ryan_USFWS.jpg;BUSINESS;1607968926.074852;The growth and accessibility of the internet has transformed the illegal wildlife trade.
Apply to Join the NOVA Science Studio;https://www.pbs.org/wgbh/nova/article/apply-join-nova-science-studio/?amp=1;null;BUSINESS;1607968926.074852;This fall, we are excited to take the NOVA Science Studio to the national stage with a virtual launch of our program that will engage students across the country.
Armenia reckons with climate change and its Soviet past through reforestation;https://www.pbs.org/wgbh/nova/article/armenia-reforestation-climate-monoculture/?amp=1;null;BUSINESS;1607968926.074852;A four-year fuel blockade in the 1990s threatened the tiny country’s forests. Ever since, it’s been replanting its trees—a task that’s more complicated than expected.
NASA’s OSIRIS-REx spacecraft will stow asteroid Bennu sample early;https://www.pbs.org/wgbh/nova/article/nasa-osiris-rex-spacecraft-stow-asteroid-bennu-sample-early/?amp=1;null;BUSINESS;1607968926.074852;OSIRIS-REx scooped up so much rock, dust, and debris from Bennu that its sampling container became jammed, causing asteroid bits to leak into outer space. Now, the mission team is reassessing its sample stowing plans.
In a swirl of rocks and dust, OSIRIS-REx probe touches an asteroid;https://www.pbs.org/wgbh/nova/article/osiris-rex-bennu-asteroid-touchdown/?amp=1;null;BUSINESS;1607968926.074852;Despite concerns that the surface of Bennu might be too rocky, the probe’s touchdown produced a dramatic shower of debris, opening the way for future insights into the mysteries of our solar system.
Where Science and Social Justice Meet;https://www.pbs.org/wgbh/nova/article/where-science-and-social-justice-meet/?amp=1;https://www.pbs.org/wgbh/nova/media/original_images/Screen_Shot_2020-10-19_at_6.01.47_PM.png;BUSINESS;1607968926.074852;Join NOVA Education for three virtual events dedicated to the intersection of STEM education and social justice.
NASA probe will attempt to grab a piece of an asteroid on Tuesday;https://www.pbs.org/wgbh/nova/article/nasa-osiris-rex-asteroid-bennu/?amp=1;null;BUSINESS;1607968926.074852;OSIRIS-REx will have just three chances to touch down and snag a sample of the asteroid Bennu as it zooms through space some 204 million miles from Earth.
Interview: National Geographic marine life photographer Cristina Mittermeier;https://www.pbs.org/wgbh/nova/article/interview-national-geographic-marine-life-photographer-cristina-mittermeier/?amp=1;null;BUSINESS;1607968926.074852;In honor of Hispanic Heritage Month, world-renowned photographer Cristina Mittermeier explains her philosophy behind conservation photography, mentorship, and the increased diversity she would like to see within the environmental movement.
The secret to peace between elephants and farmers in Mozambique? Bees;https://www.pbs.org/wgbh/nova/article/predators-fear-elephants-bees-gorongosa/?amp=1;https://www.pbs.org/wgbh/nova/media/original_images/Gorongosa_Hero.jpg;BUSINESS;1607968926.074852;Scientists use animals’ “landscapes of fear” to set limits and reestablish balance in Gorongosa National Park, where top predators were wiped out.
A calligrapher writes with light to keep tradition alive;https://www.pbs.org/wgbh/nova/article/light-calligraphy-arabic-persian/?amp=1;null;BUSINESS;1607968926.074852;Equipped with a light and a camera, Karim Jabbari hopes his work can serve as a link between conservative traditional calligraphy and our augmented reality.
Search for Exoplanets with the NOVA Exoplanet Lab;https://www.pbs.org/wgbh/nova/article/search-life-nova-exoplanet-lab/?amp=1;https://www.pbs.org/wgbh/nova/media/original_images/Exolab_Blog_Image.png;BUSINESS;1607968926.074852;You've been selected to be the lead scientist for the NOVA Space Center’s Galactic Resettlement team, with the job of finding suitable exoplanets for displaced aliens desperately seeking new homes. Are you up to the challenge?
The evolving, unexpected power of the emoji;https://www.pbs.org/wgbh/nova/article/emoji-language-culture/?amp=1;null;BUSINESS;1607968926.074852;We use emoji in texts and other messaging to set a tone, maintain relationships, and show solidarity. But are they also changing the way we think?
Finding My Voice;https://www.pbs.org/wgbh/nova/article/finding-my-voice/?amp=1;null;BUSINESS;1607968926.074852;Biomedical engineer, Khari Johnson, explains how underrepresentation in STEM fields is not due to lack of interest, aptitude or talent, but instead due to a number of systemic barriers.
Eight smart things slime molds can do without a brain;https://www.pbs.org/wgbh/nova/article/slime-mold-smart-brainless-cognition/?amp=1;null;BUSINESS;1607968926.074852;From remembering where they’ve been to recreating the Tokyo rail network, these “slimy aliens” are capable of way more than we give them credit for.
An Indigenous bioethicist on CRISPR and decolonizing DNA;https://www.pbs.org/wgbh/nova/article/bioethics-crispr-indigenous-genome/?amp=1;null;BUSINESS;1607968926.074852;Gene-editing technology is progressing faster than our ethical conversations about how we should use it. Krystal Tsosie thinks that’s a problem.
Chadwick Boseman and the rise of colon cancer in young adults;https://www.pbs.org/wgbh/nova/article/chadwick-boseman-colon-cancer-rise-young-adults/?amp=1;https://www.pbs.org/wgbh/nova/media/original_images/Chadwick.jpg;BUSINESS;1607968926.074852;Colorectal cancer is the second-leading cause of cancer deaths in the United States. Boseman’s case illustrates the importance of more screening—and addressing systemic inequities in health care.
Inside the derecho that pummeled the Midwest;https://www.pbs.org/wgbh/nova/article/derecho-wind-storm-iowa/?amp=1;null;BUSINESS;1607968926.074852;On August 10, a weather complex known as a “derecho” sent intense winds and thunderstorms over a 700-mile stretch from Nebraska to Indiana. Now, Iowa works to recover from its damage.
Dwarf planet Ceres has salty water and appears geologically active;https://www.pbs.org/wgbh/nova/article/dwarf-planet-ceres-water-geologically-active/?amp=1;null;BUSINESS;1607968926.074852;High-resolution images from NASA’s Dawn Orbiter suggest our solar system’s largest asteroid may have an ancient underground ocean, but some scientists are skeptical.
The 2020 Perseid meteor shower peaks tonight;https://www.pbs.org/wgbh/nova/article/perseid-meteor-shower-august-2020/?amp=1;null;BUSINESS;1607968926.074852;Here’s how to watch and what you’ll see.
Explore At-Home Agriculture with NOVA Education;https://www.pbs.org/wgbh/nova/article/explore-home-agriculture-nova-education/?amp=1;null;BUSINESS;1607968926.074852;"Join NOVA Education for our ""Backyard Farm to Table"" virtual field trip series about at-home agriculture."
PBS series NOVA nominated for three 2020 Emmy Awards;https://www.pbs.org/wgbh/nova/article/pbs-science-nova-emmy-awards-2020/?amp=1;null;BUSINESS;1607968926.074852;The network tops the list with 48 nominations.
NASA’s Perseverance Mars rover and first-ever space helicopter launch Thursday;https://www.pbs.org/wgbh/nova/article/mars-2020-nasa-perseverance-rover-launch/?amp=1;null;BUSINESS;1607968926.074852;The Mars 2020 mission will begin with July 30th’s launch from Cape Canaveral, Florida, at 7:50 a.m. EDT.
What polio in post-WWII America can teach us about living in a pandemic;https://www.pbs.org/wgbh/nova/article/polio-pandemic-coronavirus-vaccine/?amp=1;https://www.pbs.org/wgbh/nova/media/original_images/polio_summer.jpg;BUSINESS;1607968926.074852;My grandmother’s 1946 ‘polio summer’ featured quarantines, canceled events, and remote learning. Her story is a reminder that we’ve been here before.
How the stress of racism can harm your health—and what that has to do with Covid-19;https://www.pbs.org/wgbh/nova/article/racism-stress-covid-allostatic-load/?amp=1;null;BUSINESS;1607968926.074852;‘Allostatic load’ explains how chronic stress can cause wear and tear on the body, increasing your risk of hypertension, depression, diabetes, and more.
Interview: A disease modeler talks Covid-19, contact tracing, and quarantine;https://www.pbs.org/wgbh/nova/article/infectious-disease-modeling-covid/?amp=1;https://www.pbs.org/wgbh/nova/media/original_images/Rae_Hero.jpg;BUSINESS;1607968926.074852;Rae Wannier is trying to understand the effects of shelter-in-place orders—while sheltering in place.
Interview: Tropical paleontology and being #BlackInNature;https://www.pbs.org/wgbh/nova/article/blackinnature-tropical-paleontology/?amp=1;null;BUSINESS;1607968926.074852;Paleobiologist Melissa Kemp says humans have been introducing species to the Caribbean since long before Columbus arrived—and she’s helping piece that history together.
The unlikely journey of an eagle feather;https://www.pbs.org/wgbh/nova/article/eagle-repository-conservation-native-american/?amp=1;https://www.pbs.org/wgbh/nova/media/original_images/Eagle_Hero.jpg;BUSINESS;1607968926.074852;When an eagle dies in America, it may end up at one of our eagle repositories—unique institutions working to protect both birds of prey and Native American traditions.
Covid-19 patients sharing ventilators is possible—but not ideal;https://www.pbs.org/wgbh/nova/article/covid19-ventilators-sharing-safe/?amp=1;null;BUSINESS;1607968926.074852;The science of coventilation for coronavirus cases illustrates a complicated dilemma.
Bring Climate Science to the Digital Classroom with the Polar Lab;https://www.pbs.org/wgbh/nova/article/climate-science-digital-classroom-polar-lab/?amp=1;https://www.pbs.org/wgbh/nova/media/original_images/NOVA_PolarLab_PromoWebBanner.png;BUSINESS;1607968926.074852;Online, interactive resources for teaching climate science and climate change to middle and high school students
Five Technology Documentaries Streaming Right Now;https://www.pbs.org/wgbh/nova/article/nova-marathons-technology/?amp=1;null;BUSINESS;1607968926.074852;Five episodes exploring the revolution and ethics of technology.
Meet the NOVA Science Studio Team;https://www.pbs.org/wgbh/nova/article/meet-nova-science-studio-team/?amp=1;null;BUSINESS;1607968926.074852;
NOVA Marathons: Health & Medicine;https://www.pbs.org/wgbh/nova/article/nova-marathons-health-medicine/?amp=1;https://www.pbs.org/wgbh/nova/media/original_images/nova-wonders-whats-living-in-you-hero_3qIn6uC.jpg;BUSINESS;1607968926.074852;Six episodes exploring the fascinating science and innovations in health and medicine.
Scientists find warm water beneath Antarctica’s most at-risk glacier;https://www.pbs.org/wgbh/nova/article/warm-water-found-beneath-thwaites-glacier-antarctica/?amp=1;null;BUSINESS;1607968926.074852;Thwaites Glacier is melting fast. But to understand how climate change is driving its decline, scientists need to send instruments through 2,000 feet of ice into the water below.
Take a Virtual Field Trip with NOVA Education;https://www.pbs.org/wgbh/nova/article/take-virtual-field-trip-nova-education/?amp=1;null;BUSINESS;1607968926.074852;Join NOVA on three virtual field trips this month in celebration of Earth Day and Environmental Education Month.
NOVA Marathons: Animals;https://www.pbs.org/wgbh/nova/article/nova-marathons-animals/?amp=1;https://www.pbs.org/wgbh/nova/media/original_images/nova-wonders-what-are-animals-saying-hero_8hynUIp.jpg;BUSINESS;1607968926.074852;Five episodes exploring the companionship, communication, and amazingness of animals.
NOVA Marathons: Planet Earth;https://www.pbs.org/wgbh/nova/article/nova-marathons-planet-earth/?amp=1;null;BUSINESS;1607968926.074852;Six episodes exploring our unique and awe-inspiring planet.
NOVA Marathons: Space & The Universe;https://www.pbs.org/wgbh/nova/article/nova-marathons-space-universe/?amp=1;null;BUSINESS;1607968926.074852;Six episodes exploring the vast, mysterious, and powerful universe we live in.
NOVA Resources for At-Home Learning;https://www.pbs.org/wgbh/nova/article/nova-resources-home-learning/?amp=1;null;BUSINESS;1607968926.074852;
Experiencing Extremes: Plunging into Polar Pasts with NOVA to Reveal Future Climates;https://www.pbs.org/wgbh/nova/article/polar-pasts-reveal-future-climates/?amp=1;https://www.pbs.org/wgbh/nova/media/original_images/screenshot_bbseal_4.jpg;BUSINESS;1607968926.074852;NOVA Labs Intern Chloe Nosan reflects on her experience working on the platform's newest resource on global climate change: The Polar Lab.
The 10 most popular NOVA stories of 2019;https://www.pbs.org/wgbh/nova/article/10-most-popular-nova-stories-2019/?amp=1;null;BUSINESS;1607968926.074852;We’ve counted down our ten most-read articles of 2019 and found that health and medicine, physics—and of course animals—were fan-favorite topics this year.
How “brown fat” helps you cope with cold weather;https://www.pbs.org/wgbh/nova/article/brown-fat-cold-weather/?amp=1;null;BUSINESS;1607968926.074852;Shivering can activate a series of “heating stations” for your blood vessels—but they take a little while to get up and running.
The top 10 science stories of 2019;https://www.pbs.org/wgbh/nova/article/top-10-science-stories-2019/?amp=1;null;BUSINESS;1607968926.074852;Black holes, gene editing, and quantum computing wowed us—while new climate findings and racial bias in medicine brought renewed urgency.
What’s up with Jupiter’s wandering magnetic field?;https://www.pbs.org/wgbh/nova/article/jupiter-wandering-magnetic-field/?amp=1;null;BUSINESS;1607968926.074852;In 2018 and 2019, data from NASA’s Juno mission revealed new discoveries about Jupiter’s bizarre magnetic field.
Communities come face-to-face with the growing power of facial recognition technology;https://www.pbs.org/wgbh/nova/article/growing-power-facial-recognition-technology/?amp=1;null;BUSINESS;1607968926.074852;As law enforcement agencies deploy AI-powered facial recognition systems, some communities are pushing back, insisting on having a say in how they’re used.
Like Neanderthals, early modern humans used their teeth as tools;https://www.pbs.org/wgbh/nova/article/neanderthals-early-modern-humans-teeth-tools/?amp=1;null;BUSINESS;1607968926.074852;New findings bolster the argument that the two groups of early humans had a lot of behavioral similarities.
Dogs, drones, and DNA: How eight “extinct” species were rediscovered;https://www.pbs.org/wgbh/nova/article/eight-extinct-species-rediscovered/?amp=1;null;BUSINESS;1607968926.074852;A giant tortoise, a seabird, and a gecko all went undetected by scientists for more than a century.
How polar bear guards protect the largest Arctic expedition ever;https://www.pbs.org/wgbh/nova/article/mosaic-polarstern-polar-bear-guards/?amp=1;null;BUSINESS;1607968926.074852;A glimpse into the lives of the MOSAiC mission’s polar bear guards—and the powerful predators they watch for.
How mechanical engineering could revolutionize the study of preterm birth;https://www.pbs.org/wgbh/nova/article/biomechanics-pregnancy-childbirth-preterm-birth/?amp=1;https://www.pbs.org/wgbh/nova/media/original_images/Jasmine_Baby_Shower-5.jpg;BUSINESS;1607968926.074852;Scientists are using artificial cervices and 3D models of the uterus to better understand pregnancy and childbirth.
Anatomy professor uses 500-year-old da Vinci drawings to guide cadaver dissection;https://www.pbs.org/wgbh/nova/article/leonardo-da-vinci-anatomy-dissection/?amp=1;null;BUSINESS;1607968926.074852;Leonardo da Vinci dissected some 30 cadavers in his lifetime, leaving behind a trove of beautiful—and accurate—anatomical drawings.
Feast your eyes on the first-ever photos of a silver-backed chevrotain in the wild;https://www.pbs.org/wgbh/nova/article/silver-backed-chevrotain-rediscovered-vietnam/?amp=1;https://www.pbs.org/wgbh/nova/media/original_images/Camera-trap_photo_of_silver-backed_chevrotain_Tragulus_versicolor.jpeg;BUSINESS;1607968926.074852;The images confirm the species, which has been “lost” to science for 29 years, is alive and well in its native Vietnam.
In a controversial study, DNA from today’s southern Africans hints at possible “homeland” for modern humans;https://www.pbs.org/wgbh/nova/article/modern-human-homeland-southern-africa/?amp=1;null;BUSINESS;1607968926.074852;But many questions remain about the true origin of the Homo sapiens species.
From ashes to AI: How technology puts a new lens on ancient texts;https://www.pbs.org/wgbh/nova/article/scan-image-process-translate-ancient-text/?amp=1;null;BUSINESS;1607968926.074852;Recent breakthroughs in scanning, image processing, and machine learning are helping researchers read historic documents once considered lost to time.
Invasive, flammable grasses now blanket much of the United States;https://www.pbs.org/wgbh/nova/article/invasive-grasses-wildfire/?amp=1;null;BUSINESS;1607968926.074852;New research quantifies the fire risks of eight species of invasive grass.
Poor-quality sleep could prime the brain for an anxious day;https://www.pbs.org/wgbh/nova/article/sleep-deprivation-anxiety/?amp=1;https://www.pbs.org/wgbh/nova/media/original_images/iStock-1132649216_GYhRA9Y.jpg;BUSINESS;1607968926.074852;From a neurobiology perspective, anxiety and sleep deprivation look very much alike.
How measles virus triggers immune system ‘amnesia’;https://www.pbs.org/wgbh/nova/article/measles-immune-amnesia/?amp=1;null;BUSINESS;1607968926.074852;In addition to causing disease itself, the virus destroys immune cells trained to respond to other pathogens the body has encountered before.
Vampire bats form lasting bonds of ‘friendship,’ just like us;https://www.pbs.org/wgbh/nova/article/vampire-bat-friendship-captivity-wild/?amp=1;null;BUSINESS;1607968926.074852;The relationships these winged mammals forge in captivity are strong enough to survive the jarring transition back into the wild.
New study more than triples estimates of people at risk from rising seas;https://www.pbs.org/wgbh/nova/article/new-estimates-sea-level-rise-risk/?amp=1;null;BUSINESS;1607968926.074852;Researchers used artificial intelligence to reevaluate elevations vulnerable to rising sea levels.
Racially-biased medical algorithm prioritizes white patients over black patients;https://www.pbs.org/wgbh/nova/article/racial-bias-medical-algorithm-black-patients/?amp=1;null;BUSINESS;1607968926.074852;The algorithm was based on the faulty assumption that health care spending is a good proxy for wellbeing. But there seems to be a quick fix.
New fossils capture million-year timeline of life after the dinosaurs died;https://www.pbs.org/wgbh/nova/article/fossils-million-years-after-dinosaurs-died/?amp=1;https://www.pbs.org/wgbh/nova/media/original_images/lyson5HR.jpg;BUSINESS;1607968926.074852;Thousands of fossils from Colorado show how plants and animals evolved together after an asteroid devastated life on Earth.
Google says it just achieved “quantum supremacy.” Is it true?;https://www.pbs.org/wgbh/nova/article/google-quantum-supremacy/?amp=1;null;BUSINESS;1607968926.074852;If validated, Google’s new technology may bring us closer to a future of ultra-efficient computing.
What caused Saturn’s strange spell of storms in 2018?;https://www.pbs.org/wgbh/nova/article/saturn-white-spots-2018/?amp=1;https://www.pbs.org/wgbh/nova/media/original_images/Saturn_during_Equinox.jpg;BUSINESS;1607968926.074852;Researchers have uncovered a new category of giant storm on Saturn’s surface.
World’s loudest bird flirts by screaming in your face;https://www.pbs.org/wgbh/nova/article/white-bellbird-loudest-song/?amp=1;null;BUSINESS;1607968926.074852;Researchers aren’t sure how these birds maintain this deafening mating ritual without damaging their hearing.
These 480-million-year-old conga lines preserve early signs of group behavior;https://www.pbs.org/wgbh/nova/article/ampyx-priscus-conga-line/?amp=1;null;BUSINESS;1607968926.074852;Nearly half a billion years ago, marine arthropods called trilobites lined up single-file before meeting a tragic end.
World’s fastest-running ant scuttles over scalding Saharan sands at super speeds;https://www.pbs.org/wgbh/nova/article/saharan-silver-ant-fastest/?amp=1;https://www.pbs.org/wgbh/nova/media/original_images/CataglyphisBombycinaSandDuneHabitatDouzFotoMatthiasWittlinger.jpg;BUSINESS;1607968926.074852;Saharan silver ants don’t have the longest limbs. But they make up for it with a sprightly combination of fast pacing, light-footedness, and synchronized stepping that effectively turns their six legs into two.
Lab-grown mini-brains highlight developmental differences between humans and great apes;https://www.pbs.org/wgbh/nova/article/human-great-ape-organoid-brain/?amp=1;null;BUSINESS;1607968926.074852;In a new study, brain-like organoids made from human cells were slower to mature than their chimpanzee and macaque counterparts.
Scientists retract study linking CRISPR baby mutation to early death;https://www.pbs.org/wgbh/nova/article/crispr-baby-mutation-study-retract/?amp=1;https://www.pbs.org/wgbh/nova/media/original_images/CCR5membrane1.png;BUSINESS;1607968926.074852;The study, originally published in June, contained an error that its authors caught months later.
To predict the next infectious disease outbreak, ask a computer;https://www.pbs.org/wgbh/nova/article/infectious-disease-zoonotic-model/?amp=1;null;BUSINESS;1607968926.074852;Mathematical modeling and AI can pick out patterns preceding epidemics that human brains can’t readily discern.
Meet the second confirmed interstellar object to enter our solar system;https://www.pbs.org/wgbh/nova/article/2i-borisov-interstellar-comet/?amp=1;null;BUSINESS;1607968926.074852;The comet, 2I/Borisov, comes from another planetary system, but bears a remarkable resemblance to local space rocks.
Refrigerators of the future may be inspired by the weird physics of rubber;https://www.pbs.org/wgbh/nova/article/twistocaloric-cooling/?amp=1;https://www.pbs.org/wgbh/nova/media/original_images/iStock-1134962184.jpg;BUSINESS;1607968926.074852;A new refrigeration technique harnesses the ability of rubber and other materials to cool down when released from a tight twist.
"October Events: ""Look Who's Driving"" Screenings & Panel Discussions";https://www.pbs.org/wgbh/nova/article/october-events-look-whos-driving-screenings-panel-discussions/?amp=1;null;BUSINESS;1607968926.074852;This month, NOVA is hosting three events that will dive into how autonomous vehicles work, how they may change the way we live, and whether we will ever be able to entrust them with our lives.
Saturn unseats Jupiter as planet with the most moons in our solar system;https://www.pbs.org/wgbh/nova/article/saturn-20-new-moons/?amp=1;null;BUSINESS;1607968926.074852;Astronomers discovered 20 new moons around Saturn, bringing its total to 82.
Salts in Gale Crater suggest Mars lost its water through drastic climate fluctuations;https://www.pbs.org/wgbh/nova/article/salt-lake-gale-crater-mars/?amp=1;null;BUSINESS;1607968926.074852;New data from NASA’s Curiosity rover suggests that water vacated Mars in fits and starts.
