SNL Recap: Host Timothée Chalamet Loves Christmas In NYC, Tiny Horses & Pete Davidson - Gothamist;https://news.google.com/__i/rss/rd/articles/CBMifmh0dHA6Ly9nb3RoYW1pc3QuY29tL2FydHMtZW50ZXJ0YWlubWVudC9zbmwtcmVjYXAtaG9zdC10aW1vdGglQzMlQTllLWNoYWxhbWV0LWxvdmVzLWNocmlzdG1hcy1pbi1ueWMtdGlueS1ob3JzZXMtcGV0ZS1kYXZpZHNvbtIBlQFodHRwczovL2NoYW1wLmdvdGhhbWlzdC5jb20vY2hhbXAvZ290aGFtaXN0L2FydHMtZW50ZXJ0YWlubWVudC9zbmwtcmVjYXAtaG9zdC10aW1vdGglQzMlQTllLWNoYWxhbWV0LWxvdmVzLWNocmlzdG1hcy1pbi1ueWMtdGlueS1ob3JzZXMtcGV0ZS1kYXZpZHNvbg?oc=5;https://cms.prod.nypr.digital/images/315682/fill-1200x650/;ENTERTAINMENT;1607980969.177062;SNL Recap: Host Timothée Chalamet Loves Christmas In NYC, Tiny Horses & Pete Davidson    Gothamist Timothee Chalamet's Harry Styles Impression On SNL Set Twitter's Heart Aflutter    CinemaBlend Timothée Chalamet and Pete Davidson Are Just Two Angry Jets Fans in ‘Sportsmax’    Vulture SNL Cast, Timothee Chalamet & The Boss Offer Best Effort This Season    Bleeding Cool News SNL: Timothée Chalamet introduces the world to Tiny Horse in his debut    Last Night On View Full Coverage on Google News
Highest Paid Celebrities of 2020 Released & the Top Earner Made Almost $600 Million This Year - Just Jared;https://news.google.com/__i/rss/rd/articles/CBMidWh0dHA6Ly93d3cuanVzdGphcmVkLmNvbS8yMDIwLzEyLzE0L2hpZ2hlc3QtcGFpZC1jZWxlYnJpdGllcy1vZi0yMDIwLXJlbGVhc2VkLXRoZS10b3AtZWFybmVyLW1hZGUtYWxtb3N0LTYwMC1taWxsaW9uL9IBAA?oc=5;http://cdn01.cdn.justjared.com/wp-content/uploads/headlines/2020/12/highest-paid-2020-celebrities1.jpg;ENTERTAINMENT;1607980969.177062;Highest Paid Celebrities of 2020 Released & the Top Earner Made Almost $600 Million This Year    Just Jared
BMO downgrades Disney on valuation, likes Netflix better now - CNBC;https://news.google.com/__i/rss/rd/articles/CBMiYGh0dHBzOi8vd3d3LmNuYmMuY29tLzIwMjAvMTIvMTQvYm1vLWRvd25ncmFkZXMtZGlzbmV5LW9uLXZhbHVhdGlvbi1saWtlcy1uZXRmbGl4LWJldHRlci1ub3cuaHRtbNIBAA?oc=5;https://image.cnbcfm.com/api/v1/image/106613181-1594640454372gettyimages-1226489624.jpeg?v=1607949888;ENTERTAINMENT;1607980969.177062;BMO downgrades Disney on valuation, likes Netflix better now    CNBC Something in the Air (HSMTM The Holiday Special | Disney+)    DisneyMusicVEVO 2021’s Must-See Drama: Netflix Under Siege    Bloomberg Streaming is about to get a lot more expensive    CNN Disney's stock gets a downgrade as company begins the 'hard part' of meeting subscriber goals    MarketWatch View Full Coverage on Google News
The Dark Knight, Blues Brothers, Shrek, and More Added to National Film Registry - IGN - IGN;https://news.google.com/__i/rss/rd/articles/CBMiYmh0dHBzOi8vd3d3Lmlnbi5jb20vYXJ0aWNsZXMvdGhlLWRhcmsta25pZ2h0LWJsdWVzLWJyb3RoZXJzLXNocmVrLW5hdGlvbmFsLWZpbG0tcmVnaXN0cnktYWRkaXRpb25z0gFoaHR0cHM6Ly93d3cuaWduLmNvbS9hcnRpY2xlcy90aGUtZGFyay1rbmlnaHQtYmx1ZXMtYnJvdGhlcnMtc2hyZWstbmF0aW9uYWwtZmlsbS1yZWdpc3RyeS1hZGRpdGlvbnM_YW1wPTE?oc=5;https://assets1.ignimgs.com/2018/07/17/heathjoker-blogroll-1531863270321.jpg?width=1280;ENTERTAINMENT;1607980969.177062;The Dark Knight, Blues Brothers, Shrek, and More Added to National Film Registry - IGN    IGN National Film Registry adds 'Dark Knight,' 'The Blues Brothers' and 'Grease'    CNN National Film Registry Adds Hits And Classics To Its List Of Inductees    NPR ‘Dark Knight,’ ‘Shrek,’ ‘Grease,’ ‘Blues Brothers’ Added to National Film Registry    Variety National Film Registry adds The Dark Knight, The Hurt Locker, and, uh, Shrek    The A.V. Club View Full Coverage on Google News
Mando Mondays: Bo-Katan Flies into Hasbro's The Black Series and More! - Star Wars;https://news.google.com/__i/rss/rd/articles/CBMiYWh0dHBzOi8vd3d3LnN0YXJ3YXJzLmNvbS9uZXdzL21hbmRvLW1vbmRheXMtYm8ta2F0YW4tZmxpZXMtaW50by1oYXNicm9zLXRoZS1ibGFjay1zZXJpZXMtYW5kLW1vcmXSAQA?oc=5;https://starwarsblog.starwars.com/wp-content/uploads/2020/12/mando-mondays-12-14-COLLAGE_TALL-RATIOS-BLASTER-DOOR-th59h8.jpg;ENTERTAINMENT;1607980969.177062;Mando Mondays: Bo-Katan Flies into Hasbro's The Black Series and More!    Star Wars Star Wars: The High Republic Is as Refreshing as It Is Familiar    Gizmodo Suppose The Mandalorian Secretly Cast Luke Skywalker — Who'd Be Your Pick?    Yahoo Entertainment Star Wars The High Republic Review: A Promising New Saga – /Film    /FILM Check Out Some of the Stunning Design Work for Star Wars: The High Republic    Gizmodo View Full Coverage on Google News
Lifetime movie with Chinese American family tackles perpetual foreigner stereotype - NBC News;https://news.google.com/__i/rss/rd/articles/CBMigQFodHRwczovL3d3dy5uYmNuZXdzLmNvbS9uZXdzL2FzaWFuLWFtZXJpY2EvbGlmZXRpbWUtbW92aWUtY2hpbmVzZS1hbWVyaWNhbi1mYW1pbHktdGFja2xlcy1wZXJwZXR1YWwtZm9yZWlnbmVyLXN0ZXJlb3R5cGUtbjEyNTExMjLSASxodHRwczovL3d3dy5uYmNuZXdzLmNvbS9uZXdzL2FtcC9uY25hMTI1MTEyMg?oc=5;https://media4.s-nbcnews.com/j/newscms/2020_51/3435580/201214-lifetime-sugar-spice-jm-1036_08cc56c49068551616a9583d1db60d1a.nbcnews-fp-1200-630.jpg;ENTERTAINMENT;1607980969.177062;Lifetime movie with Chinese American family tackles perpetual foreigner stereotype    NBC News The Queer Holiday Movie Of Our Dreams    The Mary Sue The Real Reason Netflix Quietly Took 'The Grinch' Off Its Platform and How to Watch It Elsewhere    GoodHousekeeping.com 10 Great Holiday Movies You've Probably Never Seen | ScreenRant    Screen Rant New Christmas Movies & TV Series on Netflix for 2020    What's on Netflix View Full Coverage on Google News
Watch Will Ferrell and Zooey Deschanel sing 'Baby, It's Cold Outside' during 'Elf' reunion - Entertainment Weekly;https://news.google.com/__i/rss/rd/articles/CBMiWmh0dHBzOi8vZXcuY29tL21vdmllcy9lbGYtcmV1bmlvbi13aWxsLWZlcnJlbGwtem9vZXktZGVzY2hhbmVsLWJhYnktaXRzLWNvbGQtb3V0c2lkZS1kdWV0L9IBY2h0dHBzOi8vZXcuY29tL21vdmllcy9lbGYtcmV1bmlvbi13aWxsLWZlcnJlbGwtem9vZXktZGVzY2hhbmVsLWJhYnktaXRzLWNvbGQtb3V0c2lkZS1kdWV0Lz9hbXA9dHJ1ZQ?oc=5;https://imagesvc.meredithcorp.io/v3/mm/image?q=85&c=sc&poi=%5B1060%2C559%5D&w=2000&h=1047&url=https%3A%2F%2Fstatic.onecms.io%2Fwp-content%2Fuploads%2Fsites%2F6%2F2018%2F12%2FMCDELFF_EC002-2000.jpg;ENTERTAINMENT;1607980969.177062;Watch Will Ferrell and Zooey Deschanel sing 'Baby, It's Cold Outside' during 'Elf' reunion    Entertainment Weekly Ed Helms says he wants to take Senate from Mitch McConnell's 'cold purple hands' during 'Elf' reunion    Fox News Watch Zooey Deschanel and Will Ferrell Reenact Their Iconic Bathroom Duet From Elf    Yahoo Lifestyle Zooey Deschanel and Will Ferrell Reenact Iconic Elf Duet    PEOPLE 'Elf' reunion with Will Ferrell, Zooey Deschanel denied 'Santa Claus Is Comin' to Town' ending    USA TODAY View Full Coverage on Google News
Chris Harrison Teases Why Tayshia's Bachelorette Finale Has Her in TEARS (Exclusive) - Entertainment Tonight;https://news.google.com/__i/rss/rd/articles/CBMiK2h0dHBzOi8vd3d3LnlvdXR1YmUuY29tL3dhdGNoP3Y9ZEczRmU0S0xmYjDSAQA?oc=5;https://i.ytimg.com/vi/dG3Fe4KLfb0/maxresdefault.jpg;ENTERTAINMENT;1607980969.177062;"Chris Harrison Teases Why Tayshia's Bachelorette Finale Has Her in TEARS (Exclusive)    Entertainment Tonight Chris Harrison Talks Tayshia Adams' ""Bachelorette"" Drama    E! News Chris Harrison Teases 'Bachelorette' Tayshia Adams' Love Is Not 'Reciprocated' (Exclusive)    Entertainment Tonight Chris Harrison Teases Tayshia Adams' ""Contentious"" & ""Heated"" Bachelorette: Men Tell All    Yahoo Entertainment 'The Bachelorette': Tayshia Adams Doesn't Regret Telling Zac Clark She Was 'Falling in Love'    Showbiz Cheat Sheet View Full Coverage on Google News"
Khloé Kardashian sends hearts to Tristan Thompson and his son - Page Six;https://news.google.com/__i/rss/rd/articles/CBMiW2h0dHBzOi8vcGFnZXNpeC5jb20vMjAyMC8xMi8xNC9raGxvZS1rYXJkYXNoaWFuLWNvbW1lbnRzLW9uLXRyaXN0YW4tdGhvbXBzb25zLXBpYy13aXRoLXNvbi_SAV9odHRwczovL3BhZ2VzaXguY29tLzIwMjAvMTIvMTQva2hsb2Uta2FyZGFzaGlhbi1jb21tZW50cy1vbi10cmlzdGFuLXRob21wc29ucy1waWMtd2l0aC1zb24vYW1wLw?oc=5;https://pagesix.com/wp-content/uploads/sites/3/2020/11/Khloe-Kardashian-Tristan-Thompson.jpg?quality=90&strip=all&w=1200;ENTERTAINMENT;1607980969.177062;Khloé Kardashian sends hearts to Tristan Thompson and his son    Page Six Khloe Kardashian Slammed for Hearting Tristan's B-Day Message to Son    E! News Khloe Kardashian’s Fans Defend Her After She Comments on Tristan Thompson’s Pics With Son    Us Weekly Tristan Thompson Shares Sweet Birthday Tribute to Son and True's Big Brother Prince    Yahoo Entertainment Tristan Thompson shares rare picture of four-year-old son Prince on his birthday    Cosmopolitan UK View Full Coverage on Google News
Michael Jackson Estate Wins Appeal in HBO ‘Leaving Neverland’ Suit - Variety;https://news.google.com/__i/rss/rd/articles/CBMiXWh0dHBzOi8vdmFyaWV0eS5jb20vMjAyMC90di9uZXdzL21pY2hhZWwtamFja3Nvbi1sZWF2aW5nLW5ldmVybGFuZC1sYXdzdWl0LWFwcGVhbC0xMjM0ODUzMDM2L9IBYWh0dHBzOi8vdmFyaWV0eS5jb20vMjAyMC90di9uZXdzL21pY2hhZWwtamFja3Nvbi1sZWF2aW5nLW5ldmVybGFuZC1sYXdzdWl0LWFwcGVhbC0xMjM0ODUzMDM2L2FtcC8?oc=5;https://variety.com/wp-content/uploads/2019/03/leaving-neverland-hbo.jpg?w=1000;ENTERTAINMENT;1607980969.177062;Michael Jackson Estate Wins Appeal in HBO ‘Leaving Neverland’ Suit    Variety View Full Coverage on Google News
Demi Lovato posts tribute to Naya Rivera: 'Miss you' - Fox News;https://news.google.com/__i/rss/rd/articles/CBMiS2h0dHBzOi8vd3d3LmZveG5ld3MuY29tL2VudGVydGFpbm1lbnQvZGVtaS1sb3ZhdG8tcG9zdHMtdHJpYnV0ZS1uYXlhLXJpdmVyYdIBT2h0dHBzOi8vd3d3LmZveG5ld3MuY29tL2VudGVydGFpbm1lbnQvZGVtaS1sb3ZhdG8tcG9zdHMtdHJpYnV0ZS1uYXlhLXJpdmVyYS5hbXA?oc=5;https://static.foxnews.com/foxnews.com/content/uploads/2020/12/deminaya.jpg;ENTERTAINMENT;1607980969.177062;Demi Lovato posts tribute to Naya Rivera: 'Miss you'    Fox News Demi Lovato Says 'Miss You' to Naya Rivera as She Pays Tribute to Their Glee Scene    PEOPLE Demi Lovato Says 'Miss You' To Naya Rivera    Access Demi Lovato posts touching tribute to Naya Rivera    Voice Of Alexandria Demi Lovato Honors Naya Rivera With Tribute to Their 'Glee' Scene: 'Miss You'    Access Hollywood View Full Coverage on Google News
Judge freezes assets of L.A. lawyer Tom Girardi - Los Angeles Times;https://news.google.com/__i/rss/rd/articles/CBMifGh0dHBzOi8vd3d3LmxhdGltZXMuY29tL2NhbGlmb3JuaWEvc3RvcnkvMjAyMC0xMi0xNC9qdWRnZS1mcmVlemVzLWFzc2V0cy1sYXd5ZXItdG9tLWdpcmFyZGktY2l0ZXMtbWlsbGlvbnMtdW5wYWlkLXRvLWNsaWVudHPSAQA?oc=5;https://ca-times.brightspotcdn.com/dims4/default/22153be/2147483647/strip/true/crop/2048x1075+0+174/resize/1200x630!/quality/90/?url=https%3A%2F%2Fcalifornia-times-brightspot.s3.amazonaws.com%2Fec%2F79%2Fdbfa220fc5ae18bd13cb458060b3%2Fla-1908132-me-0626-bryan-stow-closing-002-ik-jpg-20140626;ENTERTAINMENT;1607980969.177062;Judge freezes assets of L.A. lawyer Tom Girardi    Los Angeles Times Erika Girardi's husband Tom held in contempt of court in Lion Air settlement suit    Page Six Erika Girardi's Husband Tom Held in Civil Contempt Over Embezzlement Allegations: Report    PEOPLE Tom Girardi's Assets Frozen After Judge Issues $2M Contempt Order    Law.com ‘Real Housewives’ Erika Jayne’s husband held in civil contempt over missing Lion Air settlement cash    Chicago Sun-Times View Full Coverage on Google News
The entertainment that got us through 2020 - The Verge;https://news.google.com/__i/rss/rd/articles/CBMiWWh0dHBzOi8vd3d3LnRoZXZlcmdlLmNvbS8yMjE1MDY2MS9lbnRlcnRhaW5tZW50LTIwMjAtbXVzaWMtZ2FtZXMtbW92aWVzLWNvbWZvcnQtZmF2b3JpdGVz0gFmaHR0cHM6Ly93d3cudGhldmVyZ2UuY29tL3BsYXRmb3JtL2FtcC8yMjE1MDY2MS9lbnRlcnRhaW5tZW50LTIwMjAtbXVzaWMtZ2FtZXMtbW92aWVzLWNvbWZvcnQtZmF2b3JpdGVz?oc=5;https://cdn.vox-cdn.com/thumbor/9cHip0QJ6W2C_FVvMNyW9umQcog=/0x146:2040x1214/fit-in/1200x630/cdn.vox-cdn.com/uploads/chorus_asset/file/22163444/acastro_201211_4335_0001.jpg;ENTERTAINMENT;1607980969.177062;The entertainment that got us through 2020    The Verge
[VIDEO] Bridgerton Trailer: Watch Shonda Rhimes' First Netflix Series - TVLine;https://news.google.com/__i/rss/rd/articles/CBMiVWh0dHBzOi8vdHZsaW5lLmNvbS8yMDIwLzEyLzE0L2JyaWRnZXJ0b24tdHJhaWxlci1zaG9uZGEtcmhpbWVzLW5ldGZsaXgtcHJlbWllcmUtZGF0ZS_SAVlodHRwczovL3R2bGluZS5jb20vMjAyMC8xMi8xNC9icmlkZ2VydG9uLXRyYWlsZXItc2hvbmRhLXJoaW1lcy1uZXRmbGl4LXByZW1pZXJlLWRhdGUvYW1wLw?oc=5;https://tvline.com/wp-content/uploads/2020/12/121408438_130081958495196_2792919842335213292_n.jpg?w=1024;ENTERTAINMENT;1607980969.177062;[VIDEO] Bridgerton Trailer: Watch Shonda Rhimes' First Netflix Series    TVLine Netflix's corset-clad, pearl-clutching Bridgerton gets a steamy new trailer    The A.V. Club Bridgerton | Official Trailer | Netflix    Netflix ‘Bridgerton’ Trailer Shows the Scandalous Side of Regency-Era England    Yahoo Entertainment Bridgerton trailer: Netflix romance has seduction, scandal, and society papers    Entertainment Weekly View Full Coverage on Google News
Will Smith Surprises Cancer-Stricken Teen with PS5, Jason Derulo Helps - TMZ;https://news.google.com/__i/rss/rd/articles/CBMiWWh0dHBzOi8vd3d3LnRtei5jb20vMjAyMC8xMi8xNC93aWxsLXNtaXRoLWphc29uLWRlcnVsby1zdXJwcmlzZS1jYW5jZXItc3RyaWNrZW4tdGVlbi1wczUv0gFZaHR0cHM6Ly9hbXAudG16LmNvbS8yMDIwLzEyLzE0L3dpbGwtc21pdGgtamFzb24tZGVydWxvLXN1cnByaXNlLWNhbmNlci1zdHJpY2tlbi10ZWVuLXBzNS8?oc=5;https://imagez.tmz.com/image/6d/16by9/2020/12/14/6d0ca0415a964ec89e4e68d9e5642284_xl.jpg;ENTERTAINMENT;1607980969.177062;Will Smith Surprises Cancer-Stricken Teen with PS5, Jason Derulo Helps    TMZ Will Smith surprises boy battling leukemia with PlayStation 5    New York Daily News Will Smith and Jason Derulo help out a teenager battling cancer on season two of Will From Home    Daily Mail View Full Coverage on Google News
Edgardo del Villar, a Telemundo news anchor, dies of cancer at 51 - NBC News;https://news.google.com/__i/rss/rd/articles/CBMiZGh0dHBzOi8vd3d3Lm5iY25ld3MuY29tL25ld3MvbGF0aW5vL2VkZ2FyZG8tZGVsLXZpbGxhci10ZWxlbXVuZG8tbmV3cy1hbmNob3ItZGllcy1jYW5jZXItNTEtbjEyNTExMzjSASxodHRwczovL3d3dy5uYmNuZXdzLmNvbS9uZXdzL2FtcC9uY25hMTI1MTEzOA?oc=5;https://media1.s-nbcnews.com/j/newscms/2020_51/3435622/201214-edgardo-del-villar-se-1239p_a5a4d5353dacf5052a6ecf7c8e91bd7b.nbcnews-fp-1200-630.jpg;ENTERTAINMENT;1607980969.177062;Edgardo del Villar, a Telemundo news anchor, dies of cancer at 51    NBC News Telemundo 47 Anchor Edgardo del Villar Dies After Battle with Brain Cancer    PEOPLE Beloved Telemundo 47 Anchor Edgardo del Villar Passes After Battle With Cancer    NBC New York Anchor Edgardo del Villar loses his battle with cancer    Media Moves Brain cancer kills beloved Telemundo news anchor    msnNOW View Full Coverage on Google News
Prince William and Kate Middleton Shared a Never-Before-Seen Family Photo on 2020 Christmas Card - Yahoo Lifestyle;https://news.google.com/__i/rss/rd/articles/CBMiU2h0dHBzOi8vd3d3LnlhaG9vLmNvbS9saWZlc3R5bGUvcHJpbmNlLXdpbGxpYW0ta2F0ZS1taWRkbGV0b24tc2hhcmVkLTE3NTAwMDIwOS5odG1s0gFbaHR0cHM6Ly93d3cueWFob28uY29tL2FtcGh0bWwvbGlmZXN0eWxlL3ByaW5jZS13aWxsaWFtLWthdGUtbWlkZGxldG9uLXNoYXJlZC0xNzUwMDAyMDkuaHRtbA?oc=5;https://s.yimg.com/uu/api/res/1.2/fQkIGdMZLBvWB9q5hdn92A--~B/aD0zNDI7dz02ODU7YXBwaWQ9eXRhY2h5b24-/https://media.zenfs.com/en/house_beautiful_336/1e9524d8eb4da4ea7536191b3c6882b8;ENTERTAINMENT;1607980969.177062;Prince William and Kate Middleton Shared a Never-Before-Seen Family Photo on 2020 Christmas Card    Yahoo Lifestyle Prince Harry and Meghan Markle Are Reportedly on Better Terms with the Royal Family    MarieClaire.com The curious timing of Prince William and Catherine's public outing with their children following royal train t    LaineyGossip Adorable Prince Louis steals the show in Cambridge family Christmas card    Yahoo! Voices Prince William Says He's Not Sure How to Explain a Risqué Joke to Prince George    MarieClaire.com View Full Coverage on Google News
Eminem responds to Barack Obama’s dramatic reading of ‘Lose Yourself’ - NME;https://news.google.com/__i/rss/rd/articles/CBMiaWh0dHBzOi8vd3d3Lm5tZS5jb20vbmV3cy9tdXNpYy9lbWluZW0tcmVzcG9uZHMtdG8tYmFyYWNrLW9iYW1hcy1kcmFtYXRpYy1yZWFkaW5nLW9mLWxvc2UteW91cnNlbGYtMjgzODQwNtIBbWh0dHBzOi8vd3d3Lm5tZS5jb20vbmV3cy9tdXNpYy9lbWluZW0tcmVzcG9uZHMtdG8tYmFyYWNrLW9iYW1hcy1kcmFtYXRpYy1yZWFkaW5nLW9mLWxvc2UteW91cnNlbGYtMjgzODQwNj9hbXA?oc=5;https://www.nme.com/wp-content/uploads/2020/12/Eminem-Obama.jpg;ENTERTAINMENT;1607980969.177062;Eminem responds to Barack Obama’s dramatic reading of ‘Lose Yourself’    NME Why Did Obama Forget Who Brought Him to the Dance?    The American Prospect Eminem Approves Of Barack Obama's Dramatic Reading Of 'Lose Yourself'    UPROXX Buzz: Obamas tops in book sales, cool the Fox-Newsmax rivalry, egos plague White House    Washington Examiner ‘No. No. No.’ Obama Said, but He Went On Anyway    The American Prospect View Full Coverage on Google News
The 'longest-ever photo exposure' has been found -- inside a drink can - CNN;https://news.google.com/__i/rss/rd/articles/CBMiU2h0dHBzOi8vd3d3LmNubi5jb20vc3R5bGUvYXJ0aWNsZS9jYW4tZWlnaHQteWVhci1waG90by1pbnRsLXNjbGktZ2JyLXNjbi9pbmRleC5odG1s0gFPaHR0cHM6Ly93d3cuY25uLmNvbS9zdHlsZS9hbXAvY2FuLWVpZ2h0LXllYXItcGhvdG8taW50bC1zY2xpLWdici1zY24vaW5kZXguaHRtbA?oc=5;https://cdn.cnn.com/cnnnext/dam/assets/201214154814-beer-can-long-exposure-super-tease.jpg;ENTERTAINMENT;1607980969.177062;The 'longest-ever photo exposure' has been found -- inside a drink can    CNN This 8-year exposure (using a beer can) might be the longest ever taken!    Digital Camera World Longest-exposure photo ever was just discovered. It was made through a beer can.    Livescience.com A Photograph With an Eight-Year Exposure Was Taken With a Beer Can    VICE Longest photo exposure of all time    Boing Boing View Full Coverage on Google News
Kelly Clarkson says Garth Brooks' song helped her cope with divorce - Today.com;https://news.google.com/__i/rss/rd/articles/CBMiZmh0dHBzOi8vd3d3LnRvZGF5LmNvbS9wb3BjdWx0dXJlL2tlbGx5LWNsYXJrc29uLXNheXMtZ2FydGgtYnJvb2tzLXNvbmctaGVscGVkLWhlci1jb3BlLWRpdm9yY2UtdDIwMzc3OdIBKmh0dHBzOi8vd3d3LnRvZGF5LmNvbS90b2RheS9hbXAvdGRuYTIwMzc3OQ?oc=5;https://media2.s-nbcnews.com/j/newscms/2020_51/1651624/kelly-clarkson-garth-brooks-kb-main-201214_eb130b5b7e58a74ab34e0df2c4b08f45.social_share_1200x630_center.jpg;ENTERTAINMENT;1607980969.177062;Kelly Clarkson says Garth Brooks' song helped her cope with divorce    Today.com Kelly Clarkson Says Garth Brooks' Song 'The Dance' Is Helping Her Cope Through Divorce    PEOPLE 'Underneath The Tree' By Kelly Clarkson | Kellyoke    The Kelly Clarkson Show Kelly Clarkson Reveals She Injured Herself Running in Heels on Set of Her Talk Show    Us Weekly Kelly Clarkson Says Garth Brooks Song Helped Her Get Through Divorce    TooFab View Full Coverage on Google News
'Helstrom' Cancelled: Marvel Drama Not Renewed for Season 2 at Hulu - TVLine;https://news.google.com/__i/rss/rd/articles/CBMiRmh0dHBzOi8vdHZsaW5lLmNvbS8yMDIwLzEyLzE0L2hlbHN0cm9tLWNhbmNlbGxlZC1zZWFzb24tMi1odWx1LW1hcnZlbC_SAUpodHRwczovL3R2bGluZS5jb20vMjAyMC8xMi8xNC9oZWxzdHJvbS1jYW5jZWxsZWQtc2Vhc29uLTItaHVsdS1tYXJ2ZWwvYW1wLw?oc=5;https://tvline.com/wp-content/uploads/2020/12/helstrom-season-2-hulu.jpg?w=620;ENTERTAINMENT;1607980969.177062;'Helstrom' Cancelled: Marvel Drama Not Renewed for Season 2 at Hulu    TVLine ‘Helstrom’ Canceled at Hulu After One Season, Ending Jeph Loeb Era of Live-Action Marvel Television    Yahoo Entertainment Helstrom canceled at Hulu after one season    The A.V. Club Hulu Cancels Marvel Series Helstrom After One Season    ComingSoon.net ‘Helstrom’ Canceled By Hulu After One Season As Marvel Ramps Up Series Output For Disney+    Yahoo Entertainment View Full Coverage on Google News
"Bringing ""Ma Rainey's Black Bottom"" to the screen - CBS Sunday Morning";https://news.google.com/__i/rss/rd/articles/CBMiK2h0dHBzOi8vd3d3LnlvdXR1YmUuY29tL3dhdGNoP3Y9ZHJ5VHk0Yml0VHfSAQA?oc=5;https://i.ytimg.com/vi/dryTy4bitTw/maxresdefault.jpg;ENTERTAINMENT;1607980969.177062;"Bringing ""Ma Rainey's Black Bottom"" to the screen    CBS Sunday Morning 'Ma Rainey's Black Bottom' Is Viola Davis At Her Most Exciting    HuffPost Reimagining August Wilson’s “Ma Rainey’s Black Bottom” on the Small Screen    The New Yorker Viola Davis on 'Ma Rainey' and Chadwick Boseman's final role    New York Daily News New this week: 'Ma Rainey's Black Bottom' and Paul McCartney    Voice Of Alexandria View Full Coverage on Google News"
Alicia Vikander To Star In TV Adaptation Of Olivier Assayas’ Feature Film ‘Irma Vep’ For HBO - Deadline;https://news.google.com/__i/rss/rd/articles/CBMiYmh0dHBzOi8vZGVhZGxpbmUuY29tLzIwMjAvMTIvYWxpY2lhLXZpa2FuZGVyLW9saXZpZXItYXNzYXlhcy1mZWF0dXJlLWZpbG0taXJtYS12ZXAtaGJvLTEyMzQ2NTYwMzIv0gFmaHR0cHM6Ly9kZWFkbGluZS5jb20vMjAyMC8xMi9hbGljaWEtdmlrYW5kZXItb2xpdmllci1hc3NheWFzLWZlYXR1cmUtZmlsbS1pcm1hLXZlcC1oYm8tMTIzNDY1NjAzMi9hbXAv?oc=5;https://deadline.com/wp-content/uploads/2020/12/pjimage-1-3.jpg?w=1024;ENTERTAINMENT;1607980969.177062;Alicia Vikander To Star In TV Adaptation Of Olivier Assayas’ Feature Film ‘Irma Vep’ For HBO    Deadline Alicia Vikander to Star in HBO Limited Series 'Irma Vep'    Hollywood Reporter Alicia Vikander to Star in HBO Series ‘Irma Vep’ From Olivier Assayas    Variety Olivier Assayas and A24’s ‘Irma Vep’ Series Heads to HBO with Alicia Vikander Starring    IndieWire Alicia Vikander Cast in 'Irma Vep' HBO Limited Series    TVLine View Full Coverage on Google News
Tyler Perry Donates $100K To Legal Defense Fund Of Breonna Taylor’s Boyfriend, Kenneth Walker - Yahoo Entertainment;https://news.google.com/__i/rss/rd/articles/CBMiUWh0dHBzOi8vd3d3LnlhaG9vLmNvbS9lbnRlcnRhaW5tZW50L3R5bGVyLXBlcnJ5LWRvbmF0ZXMtMTAway1sZWdhbC0yMzIxMzMyOTYuaHRtbNIBWWh0dHBzOi8vd3d3LnlhaG9vLmNvbS9hbXBodG1sL2VudGVydGFpbm1lbnQvdHlsZXItcGVycnktZG9uYXRlcy0xMDBrLWxlZ2FsLTIzMjEzMzI5Ni5odG1s?oc=5;https://s.yimg.com/uu/api/res/1.2/fAowVba.mtK6.FMA2KI3Sw--~B/aD01NjM7dz0xMDAwO2FwcGlkPXl0YWNoeW9u/https://media.zenfs.com/en/deadline.com/35992dba13507d8150ae038664a29c0a;ENTERTAINMENT;1607980969.177062;Tyler Perry Donates $100K To Legal Defense Fund Of Breonna Taylor’s Boyfriend, Kenneth Walker    Yahoo Entertainment Tyler Perry donates $100K to Breonna Taylor's boyfriend's defense fund    CBS This Morning Tyler Perry Donating $100k to Breonna Taylor's Boyfriend's Defense    TMZ Tyler Perry Is Helping Kenneth Walker Fight Lawsuit From LMPD Officer    MadameNoire Tyler Perry Donates $100,000 to Defense Fund for Breonna Taylor's Boyfriend    E! Online View Full Coverage on Google News
'Verzuz' battle between Ashanti, Keyshia Cole postponed after Ashanti tests positive for COVID-19 - USA TODAY;https://news.google.com/__i/rss/rd/articles/CBMijgFodHRwczovL3d3dy51c2F0b2RheS5jb20vc3RvcnkvZW50ZXJ0YWlubWVudC9tdXNpYy8yMDIwLzEyLzEzL2FzaGFudGktdGVzdHMtcG9zaXRpdmUtY292aWQtMTktdmVyenV6LWJhdHRsZS1rZXlzaGlhLWNvbGUtcG9zdHBvbmVkLzY1Mjk2MDAwMDIv0gEnaHR0cHM6Ly9hbXAudXNhdG9kYXkuY29tL2FtcC82NTI5NjAwMDAy?oc=5;https://www.gannett-cdn.com/presto/2020/12/05/USAT/4a731629-4a99-4aa3-a5d0-3362d38f85b7-ashanti_keyshia_cole.jpg?auto=webp&crop=3247,1827,x0,y0&format=pjpg&width=1200;ENTERTAINMENT;1607980969.177062;'Verzuz' battle between Ashanti, Keyshia Cole postponed after Ashanti tests positive for COVID-19    USA TODAY Ashanti reveals she's tested positive for coronavirus 'Never in a million years did I think I would get COVID'    Yahoo Entertainment 'Blow the Whistle'! The Next Verzuz Will Be a 'Rappers' Ball' With Too $hort and E-40    The Root Ashanti reveals how she was exposed to COVID-19    REVOLT TV E-40 and Too Short Set to Battle in Upcoming Verzuz    The Source Magazine View Full Coverage on Google News
How A Poignant Line Made It Into 'Soul,' Pixar's First Black-Led Film - HuffPost;https://news.google.com/__i/rss/rd/articles/CBMiWWh0dHBzOi8vd3d3Lmh1ZmZwb3N0LmNvbS9lbnRyeS9zb3VsLXBpeGFyLWZpcnN0LWJsYWNrLWxlZC1maWxtX25fNWZjN2FmOTBjNWI2M2Q4Njk1ZmIyNmNh0gE_aHR0cHM6Ly9tLmh1ZmZwb3N0LmNvbS91cy9lbnRyeS91c181ZmM3YWY5MGM1YjYzZDg2OTVmYjI2Y2EvYW1w?oc=5;https://s.yimg.com/oa/build/images/favicons/huffpo.png;ENTERTAINMENT;1607980969.177062;How A Poignant Line Made It Into 'Soul,' Pixar's First Black-Led Film    HuffPost How Soul Reflects the Way Jamie Foxx Views the Meaning of Life    IGN Soul review: Pixar's new movie is packed with jokes and whimsy, but there's one thing missing.    Slate Jamie Foxx Opens Up on the 'Abrupt' Death of Sister DeOndra Dixon    Extra How Pixar Designed the Ethereal Characters of Soul (Ft. Director Pete Docter)    IGN View Full Coverage on Google News
Offset Says He Won't Take COVID Vaccine, Doesn't Trust It - TMZ;https://news.google.com/__i/rss/rd/articles/CBMiVGh0dHBzOi8vd3d3LnRtei5jb20vMjAyMC8xMi8xMy9vZmZzZXQtd29udC10YWtlLWNvdmlkLXZhY2NpbmUtdHJ1c3QtYmxhY2stY29tbXVuaXR5L9IBVGh0dHBzOi8vYW1wLnRtei5jb20vMjAyMC8xMi8xMy9vZmZzZXQtd29udC10YWtlLWNvdmlkLXZhY2NpbmUtdHJ1c3QtYmxhY2stY29tbXVuaXR5Lw?oc=5;https://imagez.tmz.com/image/3c/16by9/2020/12/13/3c2f837f34e9414da26206d12db198c0_xl.jpg;ENTERTAINMENT;1607980969.177062;Offset Says He Won't Take COVID Vaccine, Doesn't Trust It    TMZ
Halle Berry poses pantsless in boyfriend Van Hunt's T-shirt - Page Six;https://news.google.com/__i/rss/rd/articles/CBMiWmh0dHBzOi8vcGFnZXNpeC5jb20vMjAyMC8xMi8xNC9oYWxsZS1iZXJyeS1wb3Nlcy1wYW50c2xlc3MtaW4tYm95ZnJpZW5kLXZhbi1odW50cy10LXNoaXJ0L9IBXmh0dHBzOi8vcGFnZXNpeC5jb20vMjAyMC8xMi8xNC9oYWxsZS1iZXJyeS1wb3Nlcy1wYW50c2xlc3MtaW4tYm95ZnJpZW5kLXZhbi1odW50cy10LXNoaXJ0L2FtcC8?oc=5;https://pagesix.com/wp-content/uploads/sites/3/2020/12/halle-berry-van-hunt-t-shirt.jpg?quality=90&strip=all&w=1200;ENTERTAINMENT;1607980969.177062;Halle Berry poses pantsless in boyfriend Van Hunt's T-shirt    Page Six View Full Coverage on Google News
