Indian Workers Ransack Wistron iPhone Production Plant Over Unpaid Wages - MacRumors;https://news.google.com/__i/rss/rd/articles/CBMiUWh0dHBzOi8vd3d3Lm1hY3J1bW9ycy5jb20vMjAyMC8xMi8xNC9pbmRpYW4td29ya2Vycy1yYW5zYWNrLXdpc3Ryb24taXBob25lLXBsYW50L9IBVWh0dHBzOi8vd3d3Lm1hY3J1bW9ycy5jb20vMjAyMC8xMi8xNC9pbmRpYW4td29ya2Vycy1yYW5zYWNrLXdpc3Ryb24taXBob25lLXBsYW50L2FtcC8?oc=5;https://images.macrumors.com/t/3McYCufKMFT_XHwSNgoYZwtWxnE=/1600x/http://images.macrumors.com/article-new/2018/01/iphone-6s-india-wistron.jpg;WORLD;1607969155.552764;Indian Workers Ransack Wistron iPhone Production Plant Over Unpaid Wages    MacRumors View Full Coverage on Google News
Sony, Microsoft, Nintendo unite on new set of safety principles for online gaming - The Verge;https://news.google.com/__i/rss/rd/articles/CBMidmh0dHBzOi8vd3d3LnRoZXZlcmdlLmNvbS8yMDIwLzEyLzE0LzIyMTc0MjA2L3NvbnktbWljcm9zb2Z0LW5pbnRlbmRvLXNhZmV0eS1wcmluY2lwbGVzLW9ubGluZS1nYW1pbmctc2hhcmVkLWNvbW1pdG1lbnTSAYMBaHR0cHM6Ly93d3cudGhldmVyZ2UuY29tL3BsYXRmb3JtL2FtcC8yMDIwLzEyLzE0LzIyMTc0MjA2L3NvbnktbWljcm9zb2Z0LW5pbnRlbmRvLXNhZmV0eS1wcmluY2lwbGVzLW9ubGluZS1nYW1pbmctc2hhcmVkLWNvbW1pdG1lbnQ?oc=5;https://cdn.vox-cdn.com/thumbor/mB-skQbgotJFmzlZ2aqjK5KouF0=/0x24:1200x652/fit-in/1200x630/cdn.vox-cdn.com/uploads/chorus_asset/file/22169090/Hero_Image_12112020.jpg;WORLD;1607969155.552764;Sony, Microsoft, Nintendo unite on new set of safety principles for online gaming    The Verge Xbox, PlayStation and Nintendo Partner on Commitment to Safer Gaming - IGN    IGN Microsoft, Nintendo, and Sony release ‘shared commitment to safer gaming’    Polygon Nintendo, PlayStation And Xbox Announce A Shared Commitment To Safer Gaming    Nintendo Life Microsoft, Sony, And Nintendo Team Up To Promote Safer Gaming    Kotaku View Full Coverage on Google News
A Warning To Avoid Cyberpunk 2077’s Actively Harmful Skill Perk - Forbes;https://news.google.com/__i/rss/rd/articles/CBMicWh0dHBzOi8vd3d3LmZvcmJlcy5jb20vc2l0ZXMvcGF1bHRhc3NpLzIwMjAvMTIvMTMvYS13YXJuaW5nLXRvLWF2b2lkLWN5YmVycHVuay0yMDc3cy1hY3RpdmVseS1oYXJtZnVsLXNraWxsLXBlcmsv0gF1aHR0cHM6Ly93d3cuZm9yYmVzLmNvbS9zaXRlcy9wYXVsdGFzc2kvMjAyMC8xMi8xMy9hLXdhcm5pbmctdG8tYXZvaWQtY3liZXJwdW5rLTIwNzdzLWFjdGl2ZWx5LWhhcm1mdWwtc2tpbGwtcGVyay9hbXAv?oc=5;null;WORLD;1607969155.552764;A Warning To Avoid Cyberpunk 2077’s Actively Harmful Skill Perk    Forbes Cyberpunk 2077: It's Time For Games To Scale Back | Screen Rant    Screen Rant Cyberpunk 2077: Can seizure risks be avoided in video games?    FRANCE 24 English The Best Way To Earn Money In ‘Cyberpunk 2077,’ $300K A Day Easily    Forbes Cyberpunk 2077 - How to Disassemble or Dismantle    Attack of the Fanboy View Full Coverage on Google News
The OnePlus 9 5G bares all in these early hands-on photos - Android Police;https://news.google.com/__i/rss/rd/articles/CBMiY2h0dHBzOi8vd3d3LmFuZHJvaWRwb2xpY2UuY29tLzIwMjAvMTIvMTQvdGhlLW9uZXBsdXMtOS01Zy1iYXJlcy1hbGwtaW4tdGhlc2UtZWFybHktaGFuZHMtb24tcGhvdG9zL9IBZ2h0dHBzOi8vd3d3LmFuZHJvaWRwb2xpY2UuY29tLzIwMjAvMTIvMTQvdGhlLW9uZXBsdXMtOS01Zy1iYXJlcy1hbGwtaW4tdGhlc2UtZWFybHktaGFuZHMtb24tcGhvdG9zLz9hbXA?oc=5;https://www.androidpolice.com/wp-content/uploads/2020/12/14/OnePlus-9-PhoneArena-leak.jpg;WORLD;1607969155.552764;The OnePlus 9 5G bares all in these early hands-on photos    Android Police Get your first look at a OnePlus 9 prototype    Ars Technica OnePlus 9 5G leak reveals almost everything    SlashGear OnePlus 9 Flaunts All-New Design And Snapdragon 888 In Fresh Photo Leak    Hot Hardware First OnePlus 9 Hands-On Images Have Landed With 'Ultra Shot' Cameras    Android Headlines View Full Coverage on Google News
Shiny Celebi Special Research Tasks and Rewards - Distracted by Something Shiny - Pokemon GO Hub;https://news.google.com/__i/rss/rd/articles/CBMiQmh0dHBzOi8vcG9rZW1vbmdvaHViLm5ldC9wb3N0L2d1aWRlL3NoaW55LWNlbGViaS1zcGVjaWFsLXJlc2VhcmNoL9IBAA?oc=5;https://pokemongohub.net/wp-content/uploads/2020/12/shiyn-celebi-special-research.jpg;WORLD;1607969155.552764;Shiny Celebi Special Research Tasks and Rewards - Distracted by Something Shiny    Pokemon GO Hub Pokémon: Jessie & James Return to Pokémon GO to Celebrate Secrets of the Jungle    CBR - Comic Book Resources We Need to Talk About Paid Events in Pokémon GO    Pokemon GO Hub Shiny Rufflet Is Now Live In Pokémon GO In Raids & Eggs    Bleeding Cool News Pokémon Go - Distracted by Something Shiny quest tasks and rewards: How to get shiny Celebi    Eurogamer.net View Full Coverage on Google News
Here's When You Can Download iOS 14.3 and Start Using Apple Fitness+ - MacRumors;https://news.google.com/__i/rss/rd/articles/CBMiP2h0dHBzOi8vd3d3Lm1hY3J1bW9ycy5jb20vMjAyMC8xMi8xNC93aGVuLXRvLWRvd25sb2FkLWlvcy0xNC0zL9IBQ2h0dHBzOi8vd3d3Lm1hY3J1bW9ycy5jb20vMjAyMC8xMi8xNC93aGVuLXRvLWRvd25sb2FkLWlvcy0xNC0zL2FtcC8?oc=5;https://images.macrumors.com/t/imyR5QkTAeufS8Jtxagzbx5yMBU=/2500x/https://images.macrumors.com/article-new/2020/11/Apple-fitness-plus-feature.jpg;WORLD;1607969155.552764;Here's When You Can Download iOS 14.3 and Start Using Apple Fitness+    MacRumors MacStories Selects 2020: Recognizing the Best Apps of the Year    MacStories Apple now requires app developers to disclose data collection and privacy info    Digital Trends What Are App Clips on iPhone, and How Do You Use Them?    How-To Geek Apple launches its new app privacy labels across all its App Stores    TechCrunch View Full Coverage on Google News
Nintendo Switch My Way – Fortnite - Nintendo;https://news.google.com/__i/rss/rd/articles/CBMiK2h0dHBzOi8vd3d3LnlvdXR1YmUuY29tL3dhdGNoP3Y9MFZzYXNhS2xnZjDSAQA?oc=5;https://i.ytimg.com/vi/0VsasaKlgf0/maxresdefault.jpg;WORLD;1607969155.552764;Nintendo Switch My Way – Fortnite    Nintendo Nintendo Indie World Showcase To Air Tomorrow, 15th December    Nintendo Life Nintendo Indie World Showcase Announced for Tomorrow, December 15 - IGN    IGN Nintendo is running a Direct-like Indie Showcase for Switch this week    Destructoid Nintendo will hold an Indie World live stream this Tuesday    Video Games Chronicle View Full Coverage on Google News
Google reveals top 2020 searches and the results aren’t surprising - SlashGear;https://news.google.com/__i/rss/rd/articles/CBMiZWh0dHBzOi8vd3d3LnNsYXNoZ2Vhci5jb20vZ29vZ2xlLXJldmVhbHMtdG9wLTIwMjAtc2VhcmNoZXMtYW5kLXRoZS1yZXN1bHRzLWFyZW50LXN1cnByaXNpbmctMTM2NTA5NDcv0gFpaHR0cHM6Ly93d3cuc2xhc2hnZWFyLmNvbS9nb29nbGUtcmV2ZWFscy10b3AtMjAyMC1zZWFyY2hlcy1hbmQtdGhlLXJlc3VsdHMtYXJlbnQtc3VycHJpc2luZy0xMzY1MDk0Ny9hbXAv?oc=5;https://cdn.slashgear.com/wp-content/uploads/2020/12/google_main_uns.jpg;WORLD;1607969155.552764;Google reveals top 2020 searches and the results aren’t surprising    SlashGear Google reveals the most searched terms of 2020 - you'll probably guess a few…    TechRadar Google reveals what Hongkongers searched for the most in 2020    Time Out Google releases 2020′s most searched terms    WSB Atlanta Scott Morrison’s exercise gaffe sparked an unlikely Google record    The New Daily View Full Coverage on Google News
Cheat Sheet: Breaking Down Olivia Jade and Shawn Mendes' Apologies—Plus Maren Morris' CMAs Criticism - Yahoo Entertainment;https://news.google.com/__i/rss/rd/articles/CBMiU2h0dHBzOi8vd3d3LnlhaG9vLmNvbS9lbnRlcnRhaW5tZW50L2NoZWF0LXNoZWV0LWJyZWFraW5nLWRvd24tb2xpdmlhLTE0MDAwMDM2Ni5odG1s0gFbaHR0cHM6Ly93d3cueWFob28uY29tL2FtcGh0bWwvZW50ZXJ0YWlubWVudC9jaGVhdC1zaGVldC1icmVha2luZy1kb3duLW9saXZpYS0xNDAwMDAzNjYuaHRtbA?oc=5;https://s.yimg.com/uu/api/res/1.2/E3UUlMGoNyueCWfQka1YHQ--~B/aD0xMjAwO3c9MTIwMDthcHBpZD15dGFjaHlvbg--/https://media.zenfs.com/en-us/e__181/73802a2fdddefca74e795cb89a177443;WORLD;1607969155.552764;Cheat Sheet: Breaking Down Olivia Jade and Shawn Mendes' Apologies—Plus Maren Morris' CMAs Criticism    Yahoo Entertainment View Full Coverage on Google News
Amazon Prime Video Launches on Sky in Big Coup for Comcast’s Pay-TV Provider - Variety;https://news.google.com/__i/rss/rd/articles/CBMiSmh0dHBzOi8vdmFyaWV0eS5jb20vMjAyMC90di9nbG9iYWwvc2t5LWFtYXpvbi1wcmltZS12aWRlby1kZWFsLTEyMzQ4NTE5Mzkv0gFOaHR0cHM6Ly92YXJpZXR5LmNvbS8yMDIwL3R2L2dsb2JhbC9za3ktYW1hem9uLXByaW1lLXZpZGVvLWRlYWwtMTIzNDg1MTkzOS9hbXAv?oc=5;https://variety.com/wp-content/uploads/2017/10/the-grand-tour-3.jpg?w=1000;WORLD;1607969155.552764;Amazon Prime Video Launches on Sky in Big Coup for Comcast’s Pay-TV Provider    Variety 7 Best New Movies to Watch on Amazon Prime in December 2020    Collider YEARLY DEPARTED – Official Trailer – New Comedy Special | Prime Video    Amazon Prime Video European pay-TV company Sky adds Amazon Prime to its platform    Reuters Amazon, Sky Sign Multiyear Integration Deal    Hollywood Reporter View Full Coverage on Google News
Samsung Galaxy S21 to drop the charger? What Samsung can learn from the iPhone 12 - TechRadar;https://news.google.com/__i/rss/rd/articles/CBMib2h0dHBzOi8vd3d3LnRlY2hyYWRhci5jb20vbmV3cy9zYW1zdW5nLWdhbGF4eS1zMjEtdG8tZHJvcC10aGUtY2hhcmdlci13aGF0LXNhbXN1bmctY2FuLWxlYXJuLWZyb20tdGhlLWlwaG9uZS0xMtIBc2h0dHBzOi8vd3d3LnRlY2hyYWRhci5jb20vYW1wL25ld3Mvc2Ftc3VuZy1nYWxheHktczIxLXRvLWRyb3AtdGhlLWNoYXJnZXItd2hhdC1zYW1zdW5nLWNhbi1sZWFybi1mcm9tLXRoZS1pcGhvbmUtMTI?oc=5;https://cdn.mos.cms.futurecdn.net/w92TBiFbaQZp4EEWURKDGc-1200-80.jpg;WORLD;1607969155.552764;Samsung Galaxy S21 to drop the charger? What Samsung can learn from the iPhone 12    TechRadar iPhone 12 vs. Galaxy S20 FE: Which should you buy?    Laptop Mag Hands-On Video Compares Unreleased Samsung Galaxy S21+ With iPhone 12 Pro    MacRumors In loving memory of the Galaxy Note line    Android Central Galaxy S20 FE becomes immensely popular in the US    SamMobile View Full Coverage on Google News
Realme Watch S Pro official: Teaser images and video suggest launch is imminent - Wareable;https://news.google.com/__i/rss/rd/articles/CBMiVWh0dHBzOi8vd3d3LndhcmVhYmxlLmNvbS9zbWFydHdhdGNoZXMvcmVhbG1lLXdhdGNoLXMtcHJvLWxhdW5jaC1kYXRlLXByaWNlLXNwZWNzLTgyMzTSAQA?oc=5;https://www.wareable.com/media/imager/202012/35278-posts.facebook_lg.jpg;WORLD;1607969155.552764;Realme Watch S Pro official: Teaser images and video suggest launch is imminent    Wareable realme Buds Air Pro Master Edition and realme Watch S Pro to launch on Dec. 23    gizmochina Realme Watch S Series & Realme Buds Air Pro Master Edition to Be Launched in India on December 23, 2020    LatestLY Realme X7 Pro Global Launch to Take Place on December 17 But Its Not Coming to India Yet    News18 Realme Watch S Pro, Watch S, Buds Air Pro Master Edition to Launch in India on December 23    Gadgets 360 View Full Coverage on Google News
Cyberpunk 2077 - PS5 vs Xbox Series X Backwards Compatibility Frame Rate Test - GamingBolt;https://news.google.com/__i/rss/rd/articles/CBMiK2h0dHBzOi8vd3d3LnlvdXR1YmUuY29tL3dhdGNoP3Y9VmFtSEwyX0RMa2_SAQA?oc=5;https://i.ytimg.com/vi/VamHL2_DLko/maxresdefault.jpg;WORLD;1607969155.552764;Cyberpunk 2077 - PS5 vs Xbox Series X Backwards Compatibility Frame Rate Test    GamingBolt Xbox Game Pass Players Surprised by Stealth Release    ComicBook.com These limited edition Cyberpunk 2077 PS5 and Xbox Series X wraps are stunning    T3 Microsoft’s new Xbox hits the spot    BetaBoston Conversations around the Xbox Series X and PS5 are getting better on Twitter    Techradar View Full Coverage on Google News
Peugeot Reveals LMH Powertrain Details – Sportscar365 - Sportscar365;https://news.google.com/__i/rss/rd/articles/CBMiS2h0dHBzOi8vc3BvcnRzY2FyMzY1LmNvbS9sZW1hbnMvd2VjL3BldWdlb3QtcmV2ZWFscy1sbWgtcG93ZXJ0cmFpbi1kZXRhaWxzL9IBAA?oc=5;https://sportscar365.com/wp-content/uploads/2020/12/PEUGEOT_SPORT_POWERTRAIN_REVEAL_07-1000x600.jpg;WORLD;1607969155.552764;Peugeot Reveals LMH Powertrain Details – Sportscar365    Sportscar365 Peugeot will return to Le Mans with a 939-horsepower hybrid race car    Autoblog Peugeot's new Le Mans hypercar boasts nearly 1,000bhp    Top Gear Peugeot reveals powertrain details for 2022 Hypercar    Motorsport Peugeot/ Total WEC 'Hypercar' Powertrain Revealed    Dailysportscar View Full Coverage on Google News
Here's a long list of risks, and what's missing is unsettling: Morning Brief - Yahoo Finance;https://news.google.com/__i/rss/rd/articles/CBMiaGh0dHBzOi8vZmluYW5jZS55YWhvby5jb20vbmV3cy9zdG9jay1tYXJrZXQtbGlzdC1vZi1yaXNrcy11bmtvd24tdGVycmlmeWluZy1tb3JuaW5nLWJyaWVmLTExMDAwNDc2MC5odG1s0gFwaHR0cHM6Ly9maW5hbmNlLnlhaG9vLmNvbS9hbXBodG1sL25ld3Mvc3RvY2stbWFya2V0LWxpc3Qtb2Ytcmlza3MtdW5rb3duLXRlcnJpZnlpbmctbW9ybmluZy1icmllZi0xMTAwMDQ3NjAuaHRtbA?oc=5;https://s.yimg.com/os/creatr-uploaded-images/2020-12/863bacd0-3cbf-11eb-b77d-35122d649dcd;WORLD;1607969155.552764;Here's a long list of risks, and what's missing is unsettling: Morning Brief    Yahoo Finance
Cyberpunk 2077 CPU Benchmarks: AMD vs. Intel Bottlenecks, Stutters, & Best CPUs - Gamers Nexus;https://news.google.com/__i/rss/rd/articles/CBMiK2h0dHBzOi8vd3d3LnlvdXR1YmUuY29tL3dhdGNoP3Y9LXBSSTd2WGgwSlXSAQA?oc=5;https://i.ytimg.com/vi/-pRI7vXh0JU/maxresdefault.jpg;WORLD;1607969155.552764;Cyberpunk 2077 CPU Benchmarks: AMD vs. Intel Bottlenecks, Stutters, & Best CPUs    Gamers Nexus Cyberpunk 2077 Bug Bulldozes AMD Ryzen: Here's a Fix, Tested    Tom's Hardware Cyberpunk 2077 hobbles AMD CPUs, but this IRL quickhack instantly delivers higher fps    PC Gamer Cyberpunk 2077 AMD Ryzen SMT Performance Fix Now Easier With This Simple Mod    Hot Hardware This Cyberpunk 2077 Performance Mod Addresses Various Performance Issues Including AMD SMT Usage    Wccftech View Full Coverage on Google News
Apple still has not fixed this app making users very angry - PhoneArena;https://news.google.com/__i/rss/rd/articles/CBMiamh0dHBzOi8vd3d3LnBob25lYXJlbmEuY29tL25ld3MvaXBob25lLXVzZXJzLXN0aWxsLXN1ZmZlcmluZy1mcm9tLXByb2JsZXJtcy13aXRoLXRoZS1tZXNzYWdlcy1hcHBfaWQxMjkwMzbSAW5odHRwczovL3d3dy5waG9uZWFyZW5hLmNvbS9hbXAvbmV3cy9pcGhvbmUtdXNlcnMtc3RpbGwtc3VmZmVyaW5nLWZyb20tcHJvYmxlcm1zLXdpdGgtdGhlLW1lc3NhZ2VzLWFwcF9pZDEyOTAzNg?oc=5;https://m-cdn.phonearena.com/images/article/129036-two_1200/Apple-still-has-not-fixed-this-app-making-users-very-angry.jpg;WORLD;1607969155.552764;Apple still has not fixed this app making users very angry    PhoneArena Annoying iOS 14 glitch drops SMS messages for thousands of users    TechSpot Warning Issued For Millions Of Apple iPhone Users    Forbes 5 best Apple Watch apps to download now    Mashable That iPhone Message Notification Bug is Worse Than We Thought    Gizmodo Australia View Full Coverage on Google News
Google makes it easier to try Chrome's experimental features - Engadget;https://news.google.com/__i/rss/rd/articles/CBMiUGh0dHBzOi8vd3d3LmVuZ2FkZ2V0LmNvbS9nb29nbGUtY2hyb21lLWxhYnMtZXhwZXJpbWVudGFsLWZlYXR1cmVzLTIyMzgyNzEzNi5odG1s0gFUaHR0cHM6Ly93d3cuZW5nYWRnZXQuY29tL2FtcC9nb29nbGUtY2hyb21lLWxhYnMtZXhwZXJpbWVudGFsLWZlYXR1cmVzLTIyMzgyNzEzNi5odG1s?oc=5;https://o.aolcdn.com/images/dims?resize=1200%2C630&crop=1200%2C630%2C0%2C0&quality=95&image_uri=https%3A%2F%2Fs.yimg.com%2Fos%2Fcreatr-uploaded-images%2F2020-12%2F4e328ca0-3d91-11eb-9de5-82e792a43dc2&client=amp-blogside-v2&signature=6fd8554795f0c468a52bb67ffe94841e2c8d55e3;WORLD;1607969155.552764;Google makes it easier to try Chrome's experimental features    Engadget Google's new Chrome Labs feature makes it easier to live on the bleeding edge of browsers    Android Central Google’s new Chrome Labs lets users test experimental browser features    XDA Developers Chrome Labs is making it easier to try out new, experimental browser features    Android Police Google Chrome Labs Will Let Users Try New, Experimental Features Easily on Chrome Canary    Gadgets 360 View Full Coverage on Google News
PSA: Resident Evil Village Spoilers Have Seemingly Leaked - IGN - IGN;https://news.google.com/__i/rss/rd/articles/CBMiQGh0dHBzOi8vd3d3Lmlnbi5jb20vYXJ0aWNsZXMvcmVzaWRlbnQtZXZpbC12aWxsYWdlLWxlYWstc3BvaWxlcnPSAUZodHRwczovL3d3dy5pZ24uY29tL2FydGljbGVzL3Jlc2lkZW50LWV2aWwtdmlsbGFnZS1sZWFrLXNwb2lsZXJzP2FtcD0x?oc=5;https://assets1.ignimgs.com/2020/12/14/resi8-1607943732125.jpg?width=1280;WORLD;1607969155.552764;PSA: Resident Evil Village Spoilers Have Seemingly Leaked - IGN    IGN A Resident Evil 8 development build has apparently leaked    PC Gamer Resident Evil 8 spoiler warning after fresh leak    Eurogamer.net Resident Evil 8 leak reveals story spoilers, boss fights, and more    Gamesradar Resident Evil Village Will Feature a Familiar Enemy Type, Leak Suggests    GamingBolt View Full Coverage on Google News
Nvidia's Shield TV Pro is down to an all-time low at $180 - Engadget;https://news.google.com/__i/rss/rd/articles/CBMiV2h0dHBzOi8vd3d3LmVuZ2FkZ2V0LmNvbS9udmlkaWEtc2hpZWxkLXR2LXByby1pcy1kb3duLXRvLWFuLWFsbC10aW1lLWxvdy0xMzE5NDgwMjUuaHRtbNIBW2h0dHBzOi8vd3d3LmVuZ2FkZ2V0LmNvbS9hbXAvbnZpZGlhLXNoaWVsZC10di1wcm8taXMtZG93bi10by1hbi1hbGwtdGltZS1sb3ctMTMxOTQ4MDI1Lmh0bWw?oc=5;https://o.aolcdn.com/images/dims?resize=1200%2C630&crop=1200%2C630%2C0%2C0&quality=95&image_uri=https%3A%2F%2Fs.yimg.com%2Fos%2Fcreatr-uploaded-images%2F2020-12%2F8af9f380-3e04-11eb-ab7b-eee4a949cf05&client=amp-blogside-v2&signature=7d0d3a2f5566649a8c4d365b21d0cae65404ea73;WORLD;1607969155.552764;Nvidia's Shield TV Pro is down to an all-time low at $180    Engadget Nvidia Shield and Nvidia Shield Pro Are On Sale    Cord Cutters News NVIDIA SHIELD TV Pro Down to Best Price Yet of $179    Droid Life Green Monday deals: NVIDIA SHIELD TV Pro $179, Samsung Galaxy Watch 3 $290, more    9to5Google NVIDIA SHIELD TV Pro offers 4K and HDR support, Assistant, more for $179    9to5Toys View Full Coverage on Google News
Google adds feature to improve Pixel photos that is already found on the iPhone - PhoneArena;https://news.google.com/__i/rss/rd/articles/CBMiXmh0dHBzOi8vd3d3LnBob25lYXJlbmEuY29tL25ld3MvdXBkYXRlLWhlbHBzLXlvdS1jcmVhdGUtbGV2ZWwtcGhvdG9zLXVzaW5nLXlwdXItcGl4ZWxfaWQxMjkwMzPSAQA?oc=5;https://m-cdn.phonearena.com/images/article/129033-two_1200/Google-adds-feature-to-improve-Pixel-photos-that-is-already-found-on-the-iPhone.jpg;WORLD;1607969155.552764;Google adds feature to improve Pixel photos that is already found on the iPhone    PhoneArena The Google Pixel 5 Pro Exists, Well… Kind Of    Android Headlines Google Used a 64-Camera, 331-Light Array to Train Its Portrait Lighting AI    PetaPixel Best Wallet Cases for Google Pixel 4a 5G 2020    Android Central Google details the technology behind Pixel’s Portrait Light feature    XDA Developers View Full Coverage on Google News
This iPhone technology may make a comeback in next generation of Apple phones - Mint;https://news.google.com/__i/rss/rd/articles/CBMiigFodHRwczovL3d3dy5saXZlbWludC5jb20vdGVjaG5vbG9neS9hcHBzL3RoaXMtaXBob25lLXRlY2hub2xvZ3ktbWF5LW1ha2UtYS1jb21lYmFjay1pbi1uZXh0LWdlbmVyYXRpb24tb2YtYXBwbGUtcGhvbmVzLTExNjA3ODYwNjI3ODAxLmh0bWzSAY4BaHR0cHM6Ly93d3cubGl2ZW1pbnQuY29tL3RlY2hub2xvZ3kvYXBwcy90aGlzLWlwaG9uZS10ZWNobm9sb2d5LW1heS1tYWtlLWEtY29tZWJhY2staW4tbmV4dC1nZW5lcmF0aW9uLW9mLWFwcGxlLXBob25lcy9hbXAtMTE2MDc4NjA2Mjc4MDEuaHRtbA?oc=5;https://images.livemint.com/img/2020/12/13/600x338/2020-12-10T194657Z_1628812651_RC2JKK9F3PYF_RTRMADP_3_APPLE-CYDIA-LAWSUIT_1607860717125_1607860739137.JPG;WORLD;1607969155.552764;This iPhone technology may make a comeback in next generation of Apple phones    Mint View Full Coverage on Google News
The best smart home products for 2020 that aren't made by Amazon or Google - CNET;https://news.google.com/__i/rss/rd/articles/CBMiYGh0dHBzOi8vd3d3LmNuZXQuY29tL25ld3MvYmVzdC1zbWFydC1ob21lLXByb2R1Y3RzLWZvci0yMDIwLXRoYXQtYXJlbnQtbWFkZS1ieS1hbWF6b24tb3ItZ29vZ2xlL9IBa2h0dHBzOi8vd3d3LmNuZXQuY29tL2dvb2dsZS1hbXAvbmV3cy9iZXN0LXNtYXJ0LWhvbWUtcHJvZHVjdHMtZm9yLTIwMjAtdGhhdC1hcmVudC1tYWRlLWJ5LWFtYXpvbi1vci1nb29nbGUv?oc=5;https://cnet1.cbsistatic.com/img/8tVawxdXkclbPB6FgJipT7PWokw=/1200x630/2019/10/18/cd7b233c-2f7b-46b8-a97b-ff30dc90aeea/wyze-bulb-2-720.jpg;WORLD;1607969155.552764;The best smart home products for 2020 that aren't made by Amazon or Google    CNET How to set up your smart home for less than $100    Digital Trends Top Christmas gifts to make your home smarter    TechRadar Best smart home gadgets of 2020    Gadget Flow The best smart speakers in 2020 | WIRED UK    Wired.co.uk View Full Coverage on Google News
25+ forgotten or hidden shortcuts for your Android homescreen - Android Police;https://news.google.com/__i/rss/rd/articles/CBMiZmh0dHBzOi8vd3d3LmFuZHJvaWRwb2xpY2UuY29tLzIwMjAvMTIvMTMvMjUtZm9yZ290dGVuLW9yLWhpZGRlbi1zaG9ydGN1dHMtZm9yLXlvdXItYW5kcm9pZC1ob21lc2NyZWVuL9IBamh0dHBzOi8vd3d3LmFuZHJvaWRwb2xpY2UuY29tLzIwMjAvMTIvMTMvMjUtZm9yZ290dGVuLW9yLWhpZGRlbi1zaG9ydGN1dHMtZm9yLXlvdXItYW5kcm9pZC1ob21lc2NyZWVuLz9hbXA?oc=5;https://www.androidpolice.com/wp-content/uploads/2020/12/13/homescreen-shortcuts-hero.png;WORLD;1607969155.552764;25+ forgotten or hidden shortcuts for your Android homescreen    Android Police
Why the video game boom is here to stay - CNN;https://news.google.com/__i/rss/rd/articles/CBMiRWh0dHBzOi8vd3d3LmNubi5jb20vMjAyMC8xMi8xMy90ZWNoL2dhbWluZy1yZWNlc3Npb24tcHJvb2YvaW5kZXguaHRtbNIBSWh0dHBzOi8vYW1wLmNubi5jb20vY25uLzIwMjAvMTIvMTMvdGVjaC9nYW1pbmctcmVjZXNzaW9uLXByb29mL2luZGV4Lmh0bWw?oc=5;https://cdn.cnn.com/cnnnext/dam/assets/201211153348-animal-crossing-game-0429-super-tease.jpg;WORLD;1607969155.552764;"Why the video game boom is here to stay    CNN Cyberpunk 2077: How to Get Johnny Silverhand's Pistol    Attack of the Fanboy Cyberpunk 2077 & 8 Other Awesome Video Games Keanu Reeves Appears In    Screen Rant Every Keanu Reeves Movie, Ranked    ComicBook.com Conan Reviews ""Cyberpunk 2077"" On ""Good Game Nice Try""    Team Coco View Full Coverage on Google News"
Hitman 3 - Official Opening Cinematic - IGN;https://news.google.com/__i/rss/rd/articles/CBMiK2h0dHBzOi8vd3d3LnlvdXR1YmUuY29tL3dhdGNoP3Y9TkpvTlhxVXNIcjDSAQA?oc=5;https://i.ytimg.com/vi/NJoNXqUsHr0/maxresdefault.jpg;WORLD;1607969155.552764;Hitman 3 - Official Opening Cinematic    IGN View Full Coverage on Google News
Monster Hunter Rise 'Bow' and 'Dual Blades' trailers - Gematsu;https://news.google.com/__i/rss/rd/articles/CBMiUGh0dHBzOi8vd3d3LmdlbWF0c3UuY29tLzIwMjAvMTIvbW9uc3Rlci1odW50ZXItcmlzZS1ib3ctYW5kLWR1YWwtYmxhZGVzLXRyYWlsZXJz0gEA?oc=5;https://www.gematsu.com/wp-content/uploads/2020/12/MH-Rise-Weapons_12-14-20.jpg;WORLD;1607969155.552764;Monster Hunter Rise 'Bow' and 'Dual Blades' trailers    Gematsu Monster Hunter Rise - Bow    Monster Hunter Monster Hunter Rise Trailer Shows Off New Monsters    IGN India Monster Hunter Rise New Trailers Focus on Dual Blades, Bow Weapons    Wccftech Monster Hunter Rise - Dual Blades    Monster Hunter View Full Coverage on Google News
As AWS storage revenue nears $10B, legacy players feel the heat - SiliconANGLE News;https://news.google.com/__i/rss/rd/articles/CBMiW2h0dHBzOi8vc2lsaWNvbmFuZ2xlLmNvbS8yMDIwLzEyLzEzL2F3cy1zdG9yYWdlLXJldmVudWUtbmVhcnMtMTBiLWxlZ2FjeS1wbGF5ZXJzLWZlZWwtaGVhdC_SAQA?oc=5;null;WORLD;1607969155.552764;As AWS storage revenue nears $10B, legacy players feel the heat    SiliconANGLE News
15 WORST Games of 2020 - GamingBolt;https://news.google.com/__i/rss/rd/articles/CBMiK2h0dHBzOi8vd3d3LnlvdXR1YmUuY29tL3dhdGNoP3Y9Zy1laEJOejdGNTjSAQA?oc=5;https://i.ytimg.com/vi/g-ehBNz7F58/maxresdefault.jpg;WORLD;1607969155.552764;15 WORST Games of 2020    GamingBolt Game of the Year 2020 Goes to 'The Last of Us Part II'    HYPEBEAST 2020's most controversial video game reveals the worst thing about fandom    Inverse The Game Awards 2020 Roundup - Hot off the Press Start #49    GameFront Should Games Like ‘The Last Of Us Part II’ Be Rewarded For Crunch?    Forbes View Full Coverage on Google News
Xiaomi Mi Watch Lite release date, price, features and everything else you need to know - TechRadar;https://news.google.com/__i/rss/rd/articles/CBMiM2h0dHBzOi8vd3d3LnRlY2hyYWRhci5jb20vbmV3cy94aWFvbWktbWktd2F0Y2gtbGl0ZdIBN2h0dHBzOi8vd3d3LnRlY2hyYWRhci5jb20vYW1wL25ld3MveGlhb21pLW1pLXdhdGNoLWxpdGU?oc=5;https://cdn.mos.cms.futurecdn.net/nTNdH6SWjGX3Xgb6JSccNC-1200-80.jpg;WORLD;1607969155.552764;Xiaomi Mi Watch Lite release date, price, features and everything else you need to know    TechRadar Xiaomi Mi 11 tipped to launch on December 29 beating the Galaxy S21    Android Authority Xiaomi Mi 11 tipped to launch on December 29 - GSMArena.com news    GSMArena.com Xiaomi Mi 11 series tipped for December 29 launch: What we know so far    Notebookcheck.net Xiaomi Mi 11 Tipped To Launch On December 29, As Live Images Appear    Android Headlines View Full Coverage on Google News
PS5 Beats Nintendo Switch's Hardware Launch Record in France - Push Square;https://news.google.com/__i/rss/rd/articles/CBMiY2h0dHBzOi8vd3d3LnB1c2hzcXVhcmUuY29tL25ld3MvMjAyMC8xMi9wczVfYmVhdHNfbmludGVuZG9fc3dpdGNoc19oYXJkd2FyZV9sYXVuY2hfcmVjb3JkX2luX2ZyYW5jZdIBAA?oc=5;https://images.pushsquare.com/2dc4f20ad4246/1280x720.jpg;WORLD;1607969155.552764;PS5 Beats Nintendo Switch's Hardware Launch Record in France    Push Square New Nintendo Switch Lawsuit Update Could Prove to Be Huge for Players    ComicBook.com These Unique Gifts are Perfect for the Gamers in Your Life    ExtremeTech Nov. 2020 NPD: Hyrule Warriors: Age of Calamity debuts at #6, Switch the best-selling hardware for the 24th consecutive month    GoNintendo What video games are coming out in 2021? Here are 5 of the best for PS5, Xbox, Switch    The Arizona Republic View Full Coverage on Google News
