Selena's Brother Backs Christian Serratos' Portrayal Despite Criticism - TMZ;https://news.google.com/__i/rss/rd/articles/CBMiZGh0dHBzOi8vd3d3LnRtei5jb20vMjAyMC8xMi8xNC9zZWxlbmEtYnJvdGhlci1hYi1xdWludGFuaWxsYS1zdXBwb3J0cy1jaHJpc3RpYW4tc2VycmF0b3MtdGhlLXNlcmllcy_SAWRodHRwczovL2FtcC50bXouY29tLzIwMjAvMTIvMTQvc2VsZW5hLWJyb3RoZXItYWItcXVpbnRhbmlsbGEtc3VwcG9ydHMtY2hyaXN0aWFuLXNlcnJhdG9zLXRoZS1zZXJpZXMv?oc=5;https://imagez.tmz.com/image/5b/16by9/2020/12/11/5b96a961c5624cef9cde0dc229ef04b8_xl.jpg;SPORTS;1607969155.552764;Selena's Brother Backs Christian Serratos' Portrayal Despite Criticism    TMZ 'Selena: The Series' star Noemi Gonzalez hopes the show pushes more women into 'male-dominated spaces'    Entertainment Weekly Selena Quintanilla's brother says Christian Serratos did an 'outstanding job' in the Netflix series    Daily Mail Selena's Brother Backs Christian Serratos' Portrayal Despite Criticism    TMZ Drag Queens Trixie Mattel & Katya React to Selena: The Series | I Like to Watch | Netflix    Netflix View Full Coverage on Google News
James Corden receives backlash for playing gay character in The Prom - Daily Mail;https://news.google.com/__i/rss/rd/articles/CBMidGh0dHBzOi8vd3d3LmRhaWx5bWFpbC5jby51ay90dnNob3diaXovYXJ0aWNsZS05MDQ4MTU5L0phbWVzLUNvcmRlbi1yZWNlaXZlcy1iYWNrbGFzaC1wbGF5aW5nLWdheS1jaGFyYWN0ZXItUHJvbS5odG1s0gF4aHR0cHM6Ly93d3cuZGFpbHltYWlsLmNvLnVrL3R2c2hvd2Jpei9hcnRpY2xlLTkwNDgxNTkvYW1wL0phbWVzLUNvcmRlbi1yZWNlaXZlcy1iYWNrbGFzaC1wbGF5aW5nLWdheS1jaGFyYWN0ZXItUHJvbS5odG1s?oc=5;https://i.dailymail.co.uk/1s/2020/12/13/10/36783028-0-image-a-77_1607855837460.jpg;SPORTS;1607969155.552764;James Corden receives backlash for playing gay character in The Prom    Daily Mail What I Learned From Watching 255 Minutes Of Meryl Streep    Refinery29 The Prom | Unruly Heart - Jo Ellen Pellman FULL PERFORMANCE | Netflix    Netflix The Prom: Ranking Every Song in the Movie Musical Soundtrack From Worst to Best    Den of Geek Andrew Rannells Has a Few Thoughts About James Corden Playing Gay in 'The Prom'    Towleroad View Full Coverage on Google News
The Princess Switch Trivia Quiz - BuzzFeed;https://news.google.com/__i/rss/rd/articles/CBMiQGh0dHBzOi8vd3d3LmJ1enpmZWVkLmNvbS9taWNoZWxlbGJpcmQvdGhlLXByaW5jZXNzLXN3aXRjaC10cml2aWHSAQA?oc=5;https://img.buzzfeed.com/buzzfeed-static/static/2020-12/8/19/tmp/1b444ea24dda/tmp-name-2-2069-1607455413-8_dblbig.jpg;SPORTS;1607969155.552764;The Princess Switch Trivia Quiz    BuzzFeed
Perdue blasts 'out of state' money as Georgia Senate spending expected to hit $500M - Fox News;https://news.google.com/__i/rss/rd/articles/CBMiSGh0dHBzOi8vd3d3LmZveG5ld3MuY29tL3BvbGl0aWNzL3BlcmR1ZS1nZW9yZ2lhLXJ1bm9mZi1jYWxpZm9ybmlhLW9zc29mZtIBTGh0dHBzOi8vd3d3LmZveG5ld3MuY29tL3BvbGl0aWNzL3BlcmR1ZS1nZW9yZ2lhLXJ1bm9mZi1jYWxpZm9ybmlhLW9zc29mZi5hbXA?oc=5;https://static.foxnews.com/foxnews.com/content/uploads/2020/10/David-Perdue-REUTERS.jpg;SPORTS;1607969155.552764;Perdue blasts 'out of state' money as Georgia Senate spending expected to hit $500M    Fox News
"Heartbreak and transcendence: Bringing ""Ma Rainey's Black Bottom"" to the screen - CBS News";https://news.google.com/__i/rss/rd/articles/CBMiaWh0dHBzOi8vd3d3LmNic25ld3MuY29tL25ld3MvaGVhcnRicmVhay1hbmQtdHJhbnNjZW5kZW5jZS1icmluZ2luZy1tYS1yYWluZXlzLWJsYWNrLWJvdHRvbS10by10aGUtc2NyZWVuL9IBbWh0dHBzOi8vd3d3LmNic25ld3MuY29tL2FtcC9uZXdzL2hlYXJ0YnJlYWstYW5kLXRyYW5zY2VuZGVuY2UtYnJpbmdpbmctbWEtcmFpbmV5cy1ibGFjay1ib3R0b20tdG8tdGhlLXNjcmVlbi8?oc=5;https://cbsnews2.cbsistatic.com/hub/i/r/2020/12/11/8f0f4eab-0e9a-427e-8138-fdd4bed192e7/thumbnail/1200x630/d524639a8192d053b5de4d7972a121df/ma-raineys-black-bottom-chadwick-boseman-viola-davis-colman-domingo-netflix-david-lee-1280.jpg;SPORTS;1607969155.552764;"Heartbreak and transcendence: Bringing ""Ma Rainey's Black Bottom"" to the screen    CBS News Bringing ""Ma Rainey's Black Bottom"" to the screen    CBS Sunday Morning Reimagining August Wilson’s “Ma Rainey’s Black Bottom” on the Small Screen    The New Yorker Colman Domingo interview - Euphoria star on new Netflix movie    digitalspy.com Ma Rainey: The Mother Of The Blues    uDiscover Music View Full Coverage on Google News"
Anderson Cooper's son Wyatt makes virtual appearance on CNN Heroes... as Kelly Ripa gushes over him - Daily Mail;https://news.google.com/__i/rss/rd/articles/CBMijwFodHRwczovL3d3dy5kYWlseW1haWwuY28udWsvdHZzaG93Yml6L2FydGljbGUtOTA1MDE5OS9BbmRlcnNvbi1Db29wZXJzLXNvbi1XeWF0dC1tYWtlcy12aXJ0dWFsLWFwcGVhcmFuY2UtQ05OLUhlcm9lcy1LZWxseS1SaXBhLWd1c2hlcy1oaW0uaHRtbNIBkwFodHRwczovL3d3dy5kYWlseW1haWwuY28udWsvdHZzaG93Yml6L2FydGljbGUtOTA1MDE5OS9hbXAvQW5kZXJzb24tQ29vcGVycy1zb24tV3lhdHQtbWFrZXMtdmlydHVhbC1hcHBlYXJhbmNlLUNOTi1IZXJvZXMtS2VsbHktUmlwYS1ndXNoZXMtaGltLmh0bWw?oc=5;https://i.dailymail.co.uk/1s/2020/12/14/05/36809744-0-image-a-121_1607923230677.jpg;SPORTS;1607969155.552764;Anderson Cooper's son Wyatt makes virtual appearance on CNN Heroes... as Kelly Ripa gushes over him    Daily Mail Anderson Cooper's Son Wyatt, 7 Months, Makes Surprise Appearance on CNN Special    PEOPLE Anderson Cooper Told Ina Garten That His Son Wyatt Already Has A 'Much Better' Palate Than He Does    Delish.com Anderson Cooper’s Son Wyatt Makes Adorable Appearance During ‘CNN Heroes’    ETCanada.com Ina Garten's Chocolate Peanut Butter Globs Cookie Recipe Is the Easiest Fudgy Treat to Make    Showbiz Cheat Sheet View Full Coverage on Google News
George Clooney opens up about fatherhood: 'I try to give 'em enough room to make their mistakes' - Yahoo Lifestyle;https://news.google.com/__i/rss/rd/articles/CBMiXWh0dHBzOi8vd3d3LnlhaG9vLmNvbS9saWZlc3R5bGUvZ2VvcmdlLWNsb29uZXktcGFyZW50aW5nLXF1b3Rlcy10d2lucy1wYW5kZW1pYy0yMjM5MjE4OTQuaHRtbNIBZWh0dHBzOi8vd3d3LnlhaG9vLmNvbS9hbXBodG1sL2xpZmVzdHlsZS9nZW9yZ2UtY2xvb25leS1wYXJlbnRpbmctcXVvdGVzLXR3aW5zLXBhbmRlbWljLTIyMzkyMTg5NC5odG1s?oc=5;https://s.yimg.com/ny/api/res/1.2/5QdTrPTsR1E0H001K8rQ2w--/YXBwaWQ9aGlnaGxhbmRlcjt3PTIwMDA7aD0xMzY0/https://s.yimg.com/os/creatr-uploaded-images/2020-12/522ff6d0-3d82-11eb-8f4f-226437eed1aa;SPORTS;1607969155.552764;George Clooney opens up about fatherhood: 'I try to give 'em enough room to make their mistakes'    Yahoo Lifestyle George Clooney Says He Tries to Allow His Twins, 3, 'Enough Room to Make Their Mistakes'    PEOPLE George Clooney Is Worried About Son Alexander’s Asthma Amid Coronavirus Pandemic    Us Weekly George and Amal Clooney's Twins Have Totally Different Personalities    Yahoo Lifestyle Oscar-Winning Composer Alexandre Desplat on Scoring George Clooney’s ‘Midnight Sky’ During Lockdown (EXCLUSIVE)    Variety View Full Coverage on Google News
Christopher Nolan reveals he STILL doesn't own a smartphone or use email - Daily Mail;https://news.google.com/__i/rss/rd/articles/CBMicGh0dHBzOi8vd3d3LmRhaWx5bWFpbC5jby51ay90dnNob3diaXovYXJ0aWNsZS05MDUxMTA3L0NocmlzdG9waGVyLU5vbGFuLXJldmVhbHMtZG9lc250LXNtYXJ0cGhvbmUtdXNlLWVtYWlsLmh0bWzSAXRodHRwczovL3d3dy5kYWlseW1haWwuY28udWsvdHZzaG93Yml6L2FydGljbGUtOTA1MTEwNy9hbXAvQ2hyaXN0b3BoZXItTm9sYW4tcmV2ZWFscy1kb2VzbnQtc21hcnRwaG9uZS11c2UtZW1haWwuaHRtbA?oc=5;https://i.dailymail.co.uk/1s/2020/12/14/12/36820862-0-image-a-7_1607948587150.jpg;SPORTS;1607969155.552764;Christopher Nolan reveals he STILL doesn't own a smartphone or use email    Daily Mail How 'Tenet' Star John David Washington Got 'Hot Sauce' in a Christopher Nolan Film    Complex Watch TENET’s First Six Minutes Right Now    Nerdist TENET | Prologue | Warner Bros. Entertainment    Warner Bros. Entertainment View Full Coverage on Google News
RuPaul teases gaggy 'Drag Race' lip-sync twist in season 13 trailer - Entertainment Weekly;https://news.google.com/__i/rss/rd/articles/CBMiPGh0dHBzOi8vZXcuY29tL3R2L3J1cGF1bHMtZHJhZy1yYWNlLXNlYXNvbi0xMy10cmFpbGVyLXR3aXN0L9IBRWh0dHBzOi8vZXcuY29tL3R2L3J1cGF1bHMtZHJhZy1yYWNlLXNlYXNvbi0xMy10cmFpbGVyLXR3aXN0Lz9hbXA9dHJ1ZQ?oc=5;https://imagesvc.meredithcorp.io/v3/mm/image?q=85&c=sc&poi=%5B640%2C119%5D&w=2000&h=1047&url=https%3A%2F%2Fstatic.onecms.io%2Fwp-content%2Fuploads%2Fsites%2F6%2F2020%2F12%2F14%2FDrag-Race.jpg;SPORTS;1607969155.552764;"RuPaul teases gaggy 'Drag Race' lip-sync twist in season 13 trailer    Entertainment Weekly [VIDEO] 'Drag Race' Season 13 Trailer — Premiere Elimination Twist    TVLine New ""Drag Race"" Season 13 Trailer RuVeals Shocking Lip-Sync Twist    NewNowNext RuPaul’s Drag Race Just Announced a Huge Twist For Season 13    E! NEWS Brett White's Top 10 Coping Mechanisms of 2020    Decider View Full Coverage on Google News"
Prince William and Kate Middleton's 2020 Christmas card was leaked - Insider - INSIDER;https://news.google.com/__i/rss/rd/articles/CBMiY2h0dHBzOi8vd3d3Lmluc2lkZXIuY29tL3ByaW5jZS13aWxsaWFtLWthdGUtbWlkZGxldG9uLWNhbWJyaWRnZS1mYW1pbHktY2hyaXN0bWFzLWNhcmQtcGhvdG8tMjAyMC0xMtIBZ2h0dHBzOi8vd3d3Lmluc2lkZXIuY29tL3ByaW5jZS13aWxsaWFtLWthdGUtbWlkZGxldG9uLWNhbWJyaWRnZS1mYW1pbHktY2hyaXN0bWFzLWNhcmQtcGhvdG8tMjAyMC0xMj9hbXA?oc=5;https://i.insider.com/5fd642dfe00bce00188bb102?width=1200&format=jpeg;SPORTS;1607969155.552764;Prince William and Kate Middleton's 2020 Christmas card was leaked - Insider    INSIDER Prince William Says He's Not Sure How to Explain a Risqué Joke to Prince George    MarieClaire.com Prince Harry and Meghan Markle Are Reportedly on Better Terms with the Royal Family    Yahoo Lifestyle The curious timing of Prince William and Catherine's public outing with their children following royal train t    LaineyGossip Prince William & Kate Middleton’s children make their red carpet debut for a Christmas show in London    PINKVILLA View Full Coverage on Google News
Miley Cyrus celebrates 10-year anniversary of bong video - Page Six;https://news.google.com/__i/rss/rd/articles/CBMiW2h0dHBzOi8vcGFnZXNpeC5jb20vMjAyMC8xMi8xNC9taWxleS1jeXJ1cy1tYXJrcy0xMC15ZWFyLWFubml2ZXJzYXJ5LW9mLXNtb2tpbmctYm9uZy12aWRlby_SAV9odHRwczovL3BhZ2VzaXguY29tLzIwMjAvMTIvMTQvbWlsZXktY3lydXMtbWFya3MtMTAteWVhci1hbm5pdmVyc2FyeS1vZi1zbW9raW5nLWJvbmctdmlkZW8vYW1wLw?oc=5;https://pagesix.com/wp-content/uploads/sites/3/2020/12/miley-cyrus-4.jpg?quality=90&strip=all&w=1200;SPORTS;1607969155.552764;Miley Cyrus celebrates 10-year anniversary of bong video    Page Six Miley Cyrus Re-Posted Her Infamous Salvia Bong Video On Its 10th Anniversary And I'm LOL'ing    BuzzFeed Miley Cyrus Celebrates Infamous Bong Video's 10-Year Anniversary and Answers a Burning Question    Yahoo Entertainment It's Been a Decade Since Miley Cyrus Smoked Salvia, And I Do Not Remember It Fondly    Jezebel Miley Cyrus Looks Back at Leaked Bong Video After 10 Years    Complex View Full Coverage on Google News
Yolanda Hadid shares touching snap of Gigi and Zayn Malik revealing gender of their child - Daily Mail;https://news.google.com/__i/rss/rd/articles/CBMihAFodHRwczovL3d3dy5kYWlseW1haWwuY28udWsvdHZzaG93Yml6L2FydGljbGUtOTA1MjEwOS9Zb2xhbmRhLUhhZGlkLXNoYXJlcy10b3VjaGluZy1zbmFwLUdpZ2ktWmF5bi1NYWxpay1yZXZlYWxpbmctZ2VuZGVyLWNoaWxkLmh0bWzSAYgBaHR0cHM6Ly93d3cuZGFpbHltYWlsLmNvLnVrL3R2c2hvd2Jpei9hcnRpY2xlLTkwNTIxMDkvYW1wL1lvbGFuZGEtSGFkaWQtc2hhcmVzLXRvdWNoaW5nLXNuYXAtR2lnaS1aYXluLU1hbGlrLXJldmVhbGluZy1nZW5kZXItY2hpbGQuaHRtbA?oc=5;https://i.dailymail.co.uk/1s/2020/12/14/16/36830398-0-image-a-23_1607964100417.jpg;SPORTS;1607969155.552764;Yolanda Hadid shares touching snap of Gigi and Zayn Malik revealing gender of their child    Daily Mail View Full Coverage on Google News
Suppose The Mandalorian Secretly Cast Luke Skywalker — Who'd Be Your Pick? - TVLine;https://news.google.com/__i/rss/rd/articles/CBMiW2h0dHBzOi8vdHZsaW5lLmNvbS8yMDIwLzEyLzEzL3RoZS1tYW5kYWxvcmlhbi1zZWFzb24tMi1maW5hbGUtbHVrZS1za3l3YWxrZXItY2FzdGluZy1pZGVhcy_SAV9odHRwczovL3R2bGluZS5jb20vMjAyMC8xMi8xMy90aGUtbWFuZGFsb3JpYW4tc2Vhc29uLTItZmluYWxlLWx1a2Utc2t5d2Fsa2VyLWNhc3RpbmctaWRlYXMvYW1wLw?oc=5;https://tvline.com/wp-content/uploads/2020/12/luke-skywalker-return-of-jedi.png?w=620;SPORTS;1607969155.552764;Suppose The Mandalorian Secretly Cast Luke Skywalker — Who'd Be Your Pick?    TVLine The Mandalorian's Darth Vader Easter Egg Spells Trouble for Baby Yoda    Yahoo Lifestyle The Mandalorian: Pedro Pascal's Performance Without a Helmet is Perfect    Screen Rant Mando Download: “Chapter 15: The Believer”    Star Wars The Mandalorian season 2 episode 7 recap: Mando goes undercover, with a new look    CNET View Full Coverage on Google News
'Today' anchor Craig Melvin's brother Lawrence Meadows dead at 43 of colon cancer - USA TODAY;https://news.google.com/__i/rss/rd/articles/CBMikgFodHRwczovL3d3dy51c2F0b2RheS5jb20vc3RvcnkvZW50ZXJ0YWlubWVudC90di8yMDIwLzEyLzE0L3RvZGF5LWFuY2hvci1jcmFpZy1tZWx2aW4tbW91cm5zLWJyb3RoZXItbGF3cmVuY2UtbWVhZG93cy1kaWVkLWNvbG9uLWNhbmNlci82NTM3NDAyMDAyL9IBJ2h0dHBzOi8vYW1wLnVzYXRvZGF5LmNvbS9hbXAvNjUzNzQwMjAwMg?oc=5;https://www.gannett-cdn.com/presto/2020/12/14/USAT/25082549-e868-4d23-8dd7-fe5da259af6c-Craig_Melvin.JPG?auto=webp&crop=2211,1244,x0,y332&format=pjpg&width=1200;SPORTS;1607969155.552764;'Today' anchor Craig Melvin's brother Lawrence Meadows dead at 43 of colon cancer    USA TODAY Today's Craig Melvin Mourns Death of His Brother Lawrence: 'Colon Cancer Robbed Him'    PEOPLE Craig Melvin's brother Lawrence dead from colon cancer at age 43    Page Six Craig Melvin’s brother, a pastor in SC, dies of colon cancer    The State Brother of Today host Craig Melvin dies at 43 from colon cancer    msnNOW View Full Coverage on Google News
Kenya Moore on Her Separation and RHOA's Stripper-gate! (Exclusive) - Entertainment Tonight;https://news.google.com/__i/rss/rd/articles/CBMiK2h0dHBzOi8vd3d3LnlvdXR1YmUuY29tL3dhdGNoP3Y9djZzSHIxdFQ4aFHSAQA?oc=5;https://i.ytimg.com/vi/v6sHr1tT8hQ/maxresdefault.jpg;SPORTS;1607969155.552764;"Kenya Moore on Her Separation and RHOA's Stripper-gate! (Exclusive)    Entertainment Tonight ‘RHOA’ Recap: Kenya Moore Reveals Her Plan To Divorce Marc Daly & Protect Daughter Brooklyn    Hollywood Life Has Kenya Moore Filed for Divorce from Marc Daly? | WWHL    Watch What Happens Live with Andy Cohen Kenya Moore Says She Hasn't Filed for Divorce From Marc Daly as He Is 'Fighting for His Marriage'    Entertainment Tonight Kenya Moore Addresses Drew Sidora's ""Age Bracket"" Remark from RHOA    Bravo View Full Coverage on Google News"
This New Sasha Obama Photo Tearing Through Twitter Is So Stunning - Yahoo Entertainment;https://news.google.com/__i/rss/rd/articles/CBMiVGh0dHBzOi8vd3d3LnlhaG9vLmNvbS9lbnRlcnRhaW5tZW50L3Nhc2hhLW9iYW1hLXBob3RvLXRlYXJpbmctdHdpdHRlci0wNDAwMjIwNjAuaHRtbNIBXGh0dHBzOi8vd3d3LnlhaG9vLmNvbS9hbXBodG1sL2VudGVydGFpbm1lbnQvc2FzaGEtb2JhbWEtcGhvdG8tdGVhcmluZy10d2l0dGVyLTA0MDAyMjA2MC5odG1s?oc=5;https://s.yimg.com/uu/api/res/1.2/sgMDvORkPl1H.wZ76Z6tAw--~B/aD0xMDgwO3c9MTQ0MDthcHBpZD15dGFjaHlvbg--/https://media.zenfs.com/en-US/sheknows_79/17d122adcb3914e7fc9213f74fe15679;SPORTS;1607969155.552764;This New Sasha Obama Photo Tearing Through Twitter Is So Stunning    Yahoo Entertainment Sasha Obama Defended by Celebrities as Twitter Photo Goes Viral    Newsweek View Full Coverage on Google News
Carol Sutton, New Orleans Star Known For Role In 'Steel Magnolias,' Dies At 76 - NPR;https://news.google.com/__i/rss/rd/articles/CBMic2h0dHBzOi8vd3d3Lm5wci5vcmcvMjAyMC8xMi8xMy85NDYwNDExMzcvY2Fyb2wtc3V0dG9uLW5ldy1vcmxlYW5zLXN0YXIta25vd24tZm9yLXJvbGUtaW4tc3RlZWwtbWFnbm9saWFzLWRpZXMtYXQtNzbSAQA?oc=5;;SPORTS;1607969155.552764;Carol Sutton, New Orleans Star Known For Role In 'Steel Magnolias,' Dies At 76    NPR Actress Carol Sutton dies of Covid-19 complications | World & Nation    News-Daily.com 'Lovecraft Country' Actress Carol Sutton Passes Away At 76    Essence New Orleans stage and screen actor Carol Sutton dies at 76    KATC Lafayette News Actor Carol Sutton of 'Steel Magnolias' Dies at 76    Snopes.com View Full Coverage on Google News
'The Prom' Debuted on Netflix on Friday. Here's How Twitter Reacted. - Yahoo Lifestyle;https://news.google.com/__i/rss/rd/articles/CBMiUGh0dHBzOi8vd3d3LnlhaG9vLmNvbS9saWZlc3R5bGUvcHJvbS1kZWJ1dGVkLW5ldGZsaXgtZnJpZGF5LWhlcmVzLTIyMDgwMDU3Mi5odG1s0gFYaHR0cHM6Ly93d3cueWFob28uY29tL2FtcGh0bWwvbGlmZXN0eWxlL3Byb20tZGVidXRlZC1uZXRmbGl4LWZyaWRheS1oZXJlcy0yMjA4MDA1NzIuaHRtbA?oc=5;https://s.yimg.com/uu/api/res/1.2/aQYWRxDQbpTP_TnaAEAEPQ--~B/aD03MjM7dz0xNDQwO2FwcGlkPXl0YWNoeW9u/https://media.zenfs.com/en/elle_570/c9f311e5166d41f0057a25cdffef9294;SPORTS;1607969155.552764;"'The Prom' Debuted on Netflix on Friday. Here's How Twitter Reacted.    Yahoo Lifestyle People Are Criticizing James Corden's Stereotypical, Offensive Portrayal Of A Gay Man In ""The Prom""    BuzzFeed The 10 Most Popular Movies On Netflix Right Now    HuffPost Which Meryl Streep Character Is Canonically the Best Singer?    Vulture More Movie Musicals to Watch on Netflix After 'The Prom'    Showbiz Cheat Sheet View Full Coverage on Google News"
Denzel Washington urged his protégé Chadwick Boseman to wed Taylor Simone Ledward - Daily Mail;https://news.google.com/__i/rss/rd/articles/CBMihAFodHRwczovL3d3dy5kYWlseW1haWwuY28udWsvdHZzaG93Yml6L2FydGljbGUtOTA0OTY1NS9EZW56ZWwtV2FzaGluZ3Rvbi11cmdlZC1wcm90LWctQ2hhZHdpY2stQm9zZW1hbi13ZWQtVGF5bG9yLVNpbW9uZS1MZWR3YXJkLmh0bWzSAYgBaHR0cHM6Ly93d3cuZGFpbHltYWlsLmNvLnVrL3R2c2hvd2Jpei9hcnRpY2xlLTkwNDk2NTUvYW1wL0RlbnplbC1XYXNoaW5ndG9uLXVyZ2VkLXByb3QtZy1DaGFkd2ljay1Cb3NlbWFuLXdlZC1UYXlsb3ItU2ltb25lLUxlZHdhcmQuaHRtbA?oc=5;https://i.dailymail.co.uk/1s/2020/12/14/00/36803312-0-image-a-53_1607905800510.jpg;SPORTS;1607969155.552764;Denzel Washington urged his protégé Chadwick Boseman to wed Taylor Simone Ledward    Daily Mail View Full Coverage on Google News
Kylie Jenner deems herself the 'cool aunt' as she cradles sister Kim Kardashian's youngest son Psalm - Daily Mail;https://news.google.com/__i/rss/rd/articles/CBMiiQFodHRwczovL3d3dy5kYWlseW1haWwuY28udWsvdHZzaG93Yml6L2FydGljbGUtOTA1MDIwNS9LeWxpZS1KZW5uZXItZGVlbXMtY29vbC1hdW50LWNyYWRsZXMtc2lzdGVyLUtpbS1LYXJkYXNoaWFucy15b3VuZ2VzdC1zb24tUHNhbG0uaHRtbNIBjQFodHRwczovL3d3dy5kYWlseW1haWwuY28udWsvdHZzaG93Yml6L2FydGljbGUtOTA1MDIwNS9hbXAvS3lsaWUtSmVubmVyLWRlZW1zLWNvb2wtYXVudC1jcmFkbGVzLXNpc3Rlci1LaW0tS2FyZGFzaGlhbnMteW91bmdlc3Qtc29uLVBzYWxtLmh0bWw?oc=5;https://i.dailymail.co.uk/1s/2020/12/14/04/36809134-0-image-a-145_1607921709137.jpg;SPORTS;1607969155.552764;Kylie Jenner deems herself the 'cool aunt' as she cradles sister Kim Kardashian's youngest son Psalm    Daily Mail Inside Rob Kardashian’s Return to the Spotlight in 2020    E! NEWS Kylie Jenner Jokes She’s The ‘Cool Aunt’ While Holding Psalm West, 1, In Cute New Pics    HollywoodLife Kylie Jenner Has a Hot Pink Lob Now    InStyle Kim Kardashian looks unrecognizable in flesh-flashing fitting throwbacks from Miami spin-off    Daily Mail View Full Coverage on Google News
Instagram star 'zombie' Angelina Jolie sentenced to decade in prison - Fox News;https://news.google.com/__i/rss/rd/articles/CBMiTWh0dHBzOi8vd3d3LmZveG5ld3MuY29tL2xpZmVzdHlsZS9pbnN0YWdyYW0tc3Rhci16b21iaWUtYW5nZWxpbmEtam9saWUtcHJpc29u0gFRaHR0cHM6Ly93d3cuZm94bmV3cy5jb20vbGlmZXN0eWxlL2luc3RhZ3JhbS1zdGFyLXpvbWJpZS1hbmdlbGluYS1qb2xpZS1wcmlzb24uYW1w?oc=5;https://static.foxnews.com/foxnews.com/content/uploads/2019/10/sahar-tabar-1.png;SPORTS;1607969155.552764;Instagram star 'zombie' Angelina Jolie sentenced to decade in prison    Fox News Iranian woman, 22, jailed after sharing 'zombie' selfies on Instagram    Yahoo India News Iranian teen jailed 10 years for posting on Instagram    New York Daily News Iran's zombie Angelina Jolie sentenced to 10 years in prison    Israel Hayom Angelina Jolie lookalike jailed for 10 years for 'corrupting youth'    The Express Tribune View Full Coverage on Google News
Robert Downey Jr. on Moving on From Marvel: “I’ve Done All I Could” With Iron Man - ComicBook.com;https://news.google.com/__i/rss/rd/articles/CBMicGh0dHBzOi8vY29taWNib29rLmNvbS9tb3ZpZXMvbmV3cy9yb2JlcnQtZG93bmV5LWpyLW1hcnZlbC1zdHVkaW9zLWlyb24tbWFuLXJldHVybi1kb25lLWFsbC1jb3VsZC13aXRoLWNoYXJhY3Rlci_SAXRodHRwczovL2NvbWljYm9vay5jb20vbW92aWVzL2FtcC9uZXdzL3JvYmVydC1kb3duZXktanItbWFydmVsLXN0dWRpb3MtaXJvbi1tYW4tcmV0dXJuLWRvbmUtYWxsLWNvdWxkLXdpdGgtY2hhcmFjdGVyLw?oc=5;https://media.comicbook.com/2020/12/robert-downey-jr-iron-man-marvel-avengers-endgame-1248929-1280x0.jpeg;SPORTS;1607969155.552764;"Robert Downey Jr. on Moving on From Marvel: “I’ve Done All I Could” With Iron Man    ComicBook.com Iron Man: 10 Ways The MCU Changed Tony Stark From The Comics (Good & Bad)    CBR - Comic Book Resources Marvel's Robert Downey Jr says he's done ""all I could"" with Iron Man    digitalspy.com Armor Wars: Marvel's New War Machine Show Resolves Iron Man 2's Story    Screen Rant Armor Wars: Who Will Fight in the MCU Event? | CBR    CBR - Comic Book Resources View Full Coverage on Google News"
A Charlie Brown and Coca-Cola Christmas? Holiday classic is actually missing some scenes - WJW FOX 8 News Cleveland;https://news.google.com/__i/rss/rd/articles/CBMibmh0dHBzOi8vZm94OC5jb20vbmV3cy9hLWNoYXJsaWUtYnJvd24tYW5kLWNvY2EtY29sYS1jaHJpc3RtYXMtaG9saWRheS1jbGFzc2ljLWlzLWFjdHVhbGx5LW1pc3Npbmctc29tZS1zY2VuZXMv0gFyaHR0cHM6Ly9mb3g4LmNvbS9uZXdzL2EtY2hhcmxpZS1icm93bi1hbmQtY29jYS1jb2xhLWNocmlzdG1hcy1ob2xpZGF5LWNsYXNzaWMtaXMtYWN0dWFsbHktbWlzc2luZy1zb21lLXNjZW5lcy9hbXAv?oc=5;null;SPORTS;1607969155.552764;A Charlie Brown and Coca-Cola Christmas? Holiday classic is actually missing some scenes    WJW FOX 8 News Cleveland A Charlie Brown and Coca-Cola Christmas? The holiday classic you love is actually missing some scenes    WWLP.com 'A Charlie Brown Christmas' Tonight: How to Watch, What Time and What Channel    PopCulture.com 'A Charlie Brown Christmas': The Young Actor Who Played Charlie Brown Found the Role a 'Challenge'    Showbiz Cheat Sheet How To Watch A Charlie Brown Christmas on Broadcast Television Tonight    ComicBook.com View Full Coverage on Google News
More Child Pornography Charges Laid Against Cheer Star Jerry Harris - The Root;https://news.google.com/__i/rss/rd/articles/CBMiYmh0dHBzOi8vdGhlZ3JhcGV2aW5lLnRoZXJvb3QuY29tL21vcmUtY2hpbGQtcG9ybm9ncmFwaHktY2hhcmdlcy1sYWlkLWFnYWluc3QtY2hlZXItc3Rhci0xODQ1ODczMTQx0gFmaHR0cHM6Ly90aGVncmFwZXZpbmUudGhlcm9vdC5jb20vbW9yZS1jaGlsZC1wb3Jub2dyYXBoeS1jaGFyZ2VzLWxhaWQtYWdhaW5zdC1jaGVlci1zdGFyLTE4NDU4NzMxNDEvYW1w?oc=5;https://i.kinja-img.com/gawker-media/image/upload/c_fill,f_auto,fl_progressive,g_center,h_675,pg_1,q_80,w_1200/lu2jrbzu19tsavdogfu7.png;SPORTS;1607969155.552764;More Child Pornography Charges Laid Against Cheer Star Jerry Harris    The Root ‘Cheer’s’ Jerry Harris Faces 7 New Charges In His Child Pornography Case    Yahoo Lifestyle ‘Cheer’ star Jerry Harris facing new charges amid sexual misconduct investigation    NME Netflix reality star indicted on new child pornography, sex charges    WBRZ 'Cheer' Star Facing New Federal Charges    KTVN View Full Coverage on Google News
Gizelle Bryant on if Monique Samuels Will Return to RHOP Next Season, Responds to Karen’s Shady Digs About Her Style and Says There Was “No Resolution” at Reunion, Plus Live Viewing Thread! - Reality Blurb;https://news.google.com/__i/rss/rd/articles/CBMi0AFodHRwczovL3JlYWxpdHlibHVyYi5jb20vMjAyMC8xMi8xMy9naXplbGxlLWJyeWFudC1vbi1pZi1tb25pcXVlLXNhbXVlbHMtd2lsbC1yZXR1cm4tdG8tcmhvcC1uZXh0LXNlYXNvbi1yZXNwb25kcy10by1rYXJlbnMtc2hhZHktZGlncy1hYm91dC1oZXItc3R5bGUtYW5kLXNheXMtdGhlcmUtd2FzLW5vLXJlc29sdXRpb24tYXQtcmV1bmlvbi1wbHVzLWxpdmUtdmkv0gHUAWh0dHBzOi8vcmVhbGl0eWJsdXJiLmNvbS8yMDIwLzEyLzEzL2dpemVsbGUtYnJ5YW50LW9uLWlmLW1vbmlxdWUtc2FtdWVscy13aWxsLXJldHVybi10by1yaG9wLW5leHQtc2Vhc29uLXJlc3BvbmRzLXRvLWthcmVucy1zaGFkeS1kaWdzLWFib3V0LWhlci1zdHlsZS1hbmQtc2F5cy10aGVyZS13YXMtbm8tcmVzb2x1dGlvbi1hdC1yZXVuaW9uLXBsdXMtbGl2ZS12aS9hbXAv?oc=5;https://realityblurb.com/wp-content/uploads/2020/12/Gizelle-Bryant-vs-Monique-Samuels-amd-Karen-Huger.jpg;SPORTS;1607969155.552764;Gizelle Bryant on if Monique Samuels Will Return to RHOP Next Season, Responds to Karen’s Shady Digs About Her Style and Says There Was “No Resolution” at Reunion, Plus Live Viewing Thread!    Reality Blurb Ashley Darby Reveals If She Has An Open Marriage, Slams Candiace Dillard & More |Housewives Nightcap    Access The Real Housewives of Potomac recap: Season 5, episode 20    Entertainment Weekly RHOP Reunion: Monique Samuels Reads 'Receipts,' Calls Gizelle Bryant's Relationship with Ex 'Fake'    PEOPLE.com Gizelle Bryant Responds to Criticism of Her Home Decor    Bravo View Full Coverage on Google News
MD Anderson Center in Houston receives Pfizer's COVID-19 vaccine - KTRK-TV;https://news.google.com/__i/rss/rd/articles/CBMihwFodHRwczovL2FiYzEzLmNvbS9tZC1hbmRlcnNvbi1jYW5jZXItY2VudGVyLXJlY2VpdmVzLXBmaXplci12YWNjaW5lLWhvdXN0b24tY29yb25hdmlydXMtd2hlbi13aWxsLWhvc3BpdGFscy1nZXQtY292aWQtbWV0aG9kaXN0Lzg3NjY5NjjSAYsBaHR0cHM6Ly9hYmMxMy5jb20vYW1wL21kLWFuZGVyc29uLWNhbmNlci1jZW50ZXItcmVjZWl2ZXMtcGZpemVyLXZhY2NpbmUtaG91c3Rvbi1jb3JvbmF2aXJ1cy13aGVuLXdpbGwtaG9zcGl0YWxzLWdldC1jb3ZpZC1tZXRob2Rpc3QvODc2Njk2OA?oc=5;https://cdn.abcotvs.com/dip/images/8772347_121420-vaccine-arrival-split.jpg?w=1600;BUSINESS;1607980969.177062;MD Anderson Center in Houston receives Pfizer's COVID-19 vaccine    KTRK-TV Watch the first health workers receive Pfizer's Covid-19 vaccine in New York    CNBC Television Mask on, mask off: What to know moving forward    KLKN Pfizer and Biontech have a significant commercial opportunity: Analyst    Yahoo Finance Hospitals prepare to vaccinate workers: 6 things to know    Becker's Hospital Review View Full Coverage on Google News
